url,content,date
https://finance.yahoo.com/news/seagate-technology-holdings-plc-stx-133506114.html,"We came across abullish thesison Seagate Technology Holdings plc on Stock Analysis Compilation’s Substack. In this article, we will summarize the bulls’ thesis on STX. Seagate Technology Holdings plc's share was trading at $151.94 as of July 2nd. STX’s trailing and forward P/E were 21.86 and 16.37 respectively according to Yahoo Finance. patrick-lindenberg-1iVKwElWrPA-unsplash Seagate Technology Holdings (STX) stands as a dominant force in the hard disk drive (HDD) market. Over 80% of Seagate’s revenue stems from high-capacity drives sold to hyperscalers like Google, Amazon, Meta, and Microsoft, and to enterprise server and storage OEMs. With exponential data growth driven by AI adoption, the need for high-density storage is only beginning to accelerate. Seagate is leading a pivotal transition to heat-assisted magnetic recording (HAMR), a breakthrough technology that enhances storage density and profitability. Years ahead of competitor Western Digital, Seagate has already qualified Google for its HAMR drives and is expected to announce further customer wins soon. The initial 30TB HAMR drives are ramping, but the 40TB offering in 2026 will significantly improve unit economics by raising capacity 33% and reducing costs, expanding gross margins. While Western Digital lags with a delayed 36TB HAMR release, Seagate is poised to capitalize on industry demand. HDDs remain six times cheaper per terabyte than flash-based SSDs, and given HAMR's advancements, HDDs will likely retain their cost advantage and data center dominance for the next decade. The HDD industry’s duopoly structure, disciplined capacity management, and long-term supply agreements further stabilize the market and support pricing. Seagate’s capital allocation has been highly shareholder-friendly, returning over $8 billion in five years. Despite its leadership and AI-driven growth potential, Seagate trades at just 11x 2026 earnings, presenting a compelling opportunity with the potential to double or triple from current levels. Previously, we covered abullish thesison Seagate Technology Holdings plc by fortitudelkw in Jannuary 2025, which highlighted the company’s leadership in cloud storage, HAMR technology, and AI-driven data growth. The company’s stock price has appreciated by approximately 40% since our coverage. This is because the thesis played out as expected. Stock Analysis Compilation shares a similar view but emphasizes upcoming margin expansion. Seagate Technology Holdings plc is not on our list of the30 Most Popular Stocks Among Hedge Funds. As per our database, 55 hedge fund portfolios held STX at the end of the first quarter which was 52 in the previous quarter. While we acknowledge the risk and potential of STX as an investment, our conviction lies in the belief that some AI stocks hold greater promise for delivering higher returns and have limited downside risk. If you are looking for an extremely cheap AI stock that is also a major beneficiary of Trump tariffs and onshoring, see our free report on thebest short-term AI stock. READ NEXT:8 Best Wide Moat Stocks to Buy Nowand30 Most Important AI Stocks According to BlackRock.",2025-07-04
https://finance.yahoo.com/news/microsoft-corp-msft-pushing-more-131957198.html,"Microsoft Corporation (NASDAQ:MSFT) isone of the 13 best blue-chip stocks to buy, according to analysts. On June 27, the company made it clear that artificial intelligence is an integral part of its fundamental operations. The company’s head of artificial intelligence tools and services, Julia Liuson, has instructed managers to start evaluating employees’ performance based on how they use internal AI tools. Asif Islam / Shutterstock.com The new directive is part of the company’s push to address lagging internal adoption of its Copilot services. By conducting an AI usage evaluation, Microsoft aims to increase the adoption of AI tools to enhance productivity and efficiency. In addition, the AI evaluation push also comes at a time when the company’s GitHub Copilot service is facing increasing competition from other AI coding services, such as Cursor. Microsoft has allowed its employees to use external AI tools that meet specific security requirements. Microsoft Corporation (NASDAQ:MSFT) is a software application company that develops, licenses, and supports software, services, devices, and solutions. It’s a major player in cloud computing, productivity software, gaming, and more. While we acknowledge the potential of MSFT as an investment, we believe certain AI stocks offer greater upside potential and carry less downside risk. If you're looking for an extremely undervalued AI stock that also stands to benefit significantly from Trump-era tariffs and the onshoring trend, see our free report on thebest short-term AI stock. READ NEXT:10 Most Undervalued Gold Stocks to Buy According To Analystsand10 Undervalued Tech Stocks Flying Under Wall Street’s Radar. Disclosure: None.",2025-07-04
https://finance.yahoo.com/news/microsoft-commences-deep-cuts-across-131524954.html,"Microsoft (MSFT) is starting “deep” cuts across its Xbox unit, Bloomberg’s Jason Schreier reports. Its King division, which makes Candy Crush, is laying off 10% of its staff, or about 200 jobs, while other European offices, such as ZeniMax, have also started informing employees that job cuts are happening, according to people familiar with the plans. U.S. units are expected to be told on Wednesday how many jobs will be cut at each office. This is the fourth mass layoff at Xbox in the last 18 months. Take advantage ofTipRanks Premium at 50% off!Unlock powerful investing tools, advanced data, and expert analyst insights to help you invest with confidence. Make smarter investment decisions withTipRanks' Smart Investor Picks, delivered to your inbox every week. Published first onTheFly– the ultimate source for real-time, market-moving breaking financial news.Try Now>> See today’s best-performing stocks on TipRanks >> Read More on MSFT: Disclaimer & DisclosureReport an Issue DeepSeek and Qwen Gain Global Ground: What This Means for U.S.AILeaders Like GOOG, MSFT, and NVDA Nintendo Stock (NTDOF) Dips Despite Huge Switch 2 Sales Update Nvidia Stock (NVDA) Nears $4 Trillion Market Cap as AI Trade Accelerates Microsoft Updates Bylaws to Enhance Shareholder Engagement NVDA, TSLA, META: Analyst Dan Ives Says Nasdaq Can Rise Another 15% This Year",2025-07-04
https://finance.yahoo.com/news/pryon-named-ai-data-management-131300269.html,"Industry recognition validates Pryon's leadership in solving the most critical barrier to enterprise AI ROI: creating a trusted, accurate memory foundation for agentic solutions NEW YORK,July 3, 2025/PRNewswire/ --Pryon, the definitive leader in enterprise AI memory solutions, today announced its recognition as the ""AI Data Management Solution of the Year"" in the prestigious 8th annual AI Breakthrough Awards. The AI Breakthrough Awards evaluated more than 5,000 nominations from over 20 countries, making this recognition particularly significant as AI adoption accelerates globally. This honor places Pryon among elite technology innovators, including NVIDIA, Microsoft, Meta, and Databricks, in the global AI landscape. In today's enterprise environment, the single greatest barrier to realizing return on AI investments isn't technology access—it's information reliability. While 90% of businesses view agentic AI as essential for competitive advantage, Gartner projects over 40% of agentic AI initiatives will fail by 2027, with accuracy and trust cited as the primary obstacles. ""Enterprises are discovering a harsh reality: without a reliable memory layer, AI investments become costly experiments rather than transformative solutions,"" saidChris Mahl, CEO of Pryon. ""In a world where AI agents take action on behalf of your business, hallucinations aren't just problematic—they're catastrophic to both operations and trust. Pryon's Memory Layer eliminates this fundamental risk."" Introducing The Pryon Memory Layer Pryon has redefined how organizations approach their AI strategies by creating what analysts now recognize as the essential foundation for any successful enterprise AI deployment: a unified, trustworthy memory layer. Unlike conventional data management approaches, Pryon's platform: Transforms scattered knowledgefrom documents, videos, images, and conversations into a cohesive AI memory foundation Delivers unmatched retrieval accuracyexceeding 90% through proprietary Retrieval-Augmented Generation technology Provides real-time, verifiable accessto critical information while maintaining complete data privacy Scales seamlesslyacross large organizations to support complex, mission-critical AI deployments Driving Measurable AI ROI What sets Pryon apart is its focus on measurable business outcomes: 3-5x faster deploymentof agentic AI solutions compared to competitors 95%+ accuracyin milliseconds at scale across agentic production 60% improvementin employee productivity through streamlined knowledge access ""The market has been flooded with promises about AI potential, but Pryon delivers something more valuable: AI certainty,"" said Mahl. ""Our Memory Layer becomes the single source of truth that transforms AI from an interesting technology into a reliable business asset that delivers consistent ROI."" Government Validation and Mission-Critical Deployment Pryon's technology has received significant validation from government agencies seeking to harness AI while maintaining the highest standards of security and accuracy. The platform's unique architecture enables unprecedented deployment flexibility, allowing it to function seamlessly in diverse environments: Secure air-gapped facilitieswith zero external connectivity Hybrid cloud-to-edge configurationsfor remote field operations Rapidly deployable containerized solutionsfor time-sensitive missions Cross-domain capablewith appropriate security controls This deployment versatility ensures that Pryon's Memory Layer can be implemented precisely where mission requirements dictate, without compromising security or performance. Mahl continued, ""This award establishes us as the foundation player for scale and accuracy. Our Pryon Hyperscale release will be delivering unprecedented memory capabilities that enable enterprises to deploy agentic AI at exascale performance levels, while maintaining the precision and reliability that mission-critical operations demand."" About Pryon Pryon provides the trusted AI memory layer that ensures success for enterprise generative and agentic AI implementations. Created by the AI pioneers instrumental in developing Alexa, Siri, andWatson, Pryon's platform delivers accurate, instant, and verifiable answers at enterprise scale across all content forms. Deployed via cloud, on-premises, or air-gapped environments, Pryon's Memory Layer serves as the authoritative knowledge backbone for AI agents while maintaining the highest security standards for government and commercial use. For more information, please visithttps://www.pryon.com/ View original content:https://www.prnewswire.com/news-releases/pryon-named-ai-data-management-solution-of-the-year-for-pioneering-enterprise-ai-memory-layer-technology-302497671.html SOURCE Pryon",2025-07-04
https://finance.yahoo.com/news/dan-ives-backed-etf-could-130700794.html,"The Dan Ives AI Revolution ETF limits the influence of mega-cap tech stocks, such as Nvidia and Microsoft. It still explores the exciting AI opportunity with 30 hand-picked stocks in that market. This nearly equal-weighted ETF could appeal to investors seeking more diversification in the AI sector. 10 stocks we like better than Wedbush Series Trust - Dan Ives Wedbush Ai Revolution ETF › The artificial intelligence (AI) revolution is shaking Wall Street to its very foundations.The ""Magnificent Seven"" groupof market-defining AI stocks all rank among the 12 highest-valued securities on the market today. Together, this group accounts for 32.3% of theS&P 500(SNPINDEX: ^GSPC)index's total score, and 61.9% of the tech-heavyNasdaq 100index. These are the market darlings of this era, all trading at lofty valuations and perhaps headed toward a painful price correction someday soon. What if you're not comfortable giving so much weight to a risky bunch of recent market beaters? Remember, past performance does not guarantee that future returns will be similar. Well-known analyst Dan Ives just launched a hand-vetted fund that provides targeted investments inthe AI boom, but with lower influence from the handful of top-ranked giants. Let's see what's different about this exchange-traded fund (ETF), so you can decide whether it belongs in your portfolio. TheDan Ives Wedbush AI Revolution ETF(NYSEMKT: IVES)is technically an index fund, but the underlying index is a custom list that simply reflects the stock pick in Ives' top-30 AI stock-picking reports. It was launched just days before the related ETF. So the index formulation is just a technicality. The Wedbush analyst with a long research history and a penchant for colorful suits is really making these stock picks in a very direct sense. At the same time, the index structure adds some academic rigidity to the ETF. New additions to the index (and ETF) are given a cap-based weight between 1% and 4% of the total portfolio, no exceptions. The index is rebalanced four times a year, on the third Fridays of March, June, September, and December. The hard caps of at least 1% but no more than 4% are reapplied at each of these events, making sure that no single stock ever represents a huge slice of the Dan Ives ETF. The annual expense ratio is 0.75%, far above the leading S&P 500 index funds and comparable to many handpicked stock collections. On June 30, just 27 calendar days after the ETF's inception, the ""Magnificent Seven"" stocks added up to 32.6% of the Ives fund's value. That's actually a smidge higher than their combined slice of the S&P 500, but megacapsNvidia(NASDAQ: NVDA)andMicrosoft(NASDAQ: MSFT)hold significantly lighter weights in the Dan Ives portfolio. Nineteen of the 30 components ran into the 4% top-end weighting cap at the latest rebalancing, making alternatives such asIBM(NYSE: IBM)andAdvanced Micro Devices(NASDAQ: AMD)just as important to the ETF's value as any of the Magnificent Seven. No ETF can guarantee market-beating returns, and AI is a volatile field right now. I can't guarantee that Ives' selections will outperform the broader market in the long run, or that the nearly equal-weighted nature of this fund is a better idea than the market cap weightings seen in many other ETFs. But if you're looking for a lower-risk approach to the exciting but risky AI market, the Dan Ives AI Revolution ETF might hit the spot. Its careful rebalancing policy sets this fund apart from most of its rivals. Ives' decades of market analysis experience should be worth something, too. The fund is too young to do a deep dive into its market performance, but it's off to a strong start in its first month of operation. Only time will tell how this ETF will stack up in the long run, but its lower risk profile could be right for your portfolio. After all, it will hurt less to hold the Dan Ives ETF if a top stock like Nvidia or Microsoft takes a big tumble. As always, do your own research before you buy anything -- but if you want a smarter, more diversified way to play the AI revolution, this ETF might just fit the bill. Before you buy stock in Wedbush Series Trust - Dan Ives Wedbush Ai Revolution ETF, consider this: TheMotley Fool Stock Advisoranalyst team just identified what they believe are the10 best stocksfor investors to buy now… and Wedbush Series Trust - Dan Ives Wedbush Ai Revolution ETF wasn’t one of them. The 10 stocks that made the cut could produce monster returns in the coming years. Consider whenNetflixmade this list on December 17, 2004... if you invested $1,000 at the time of our recommendation,you’d have $692,914!*Or whenNvidiamade this list on April 15, 2005... if you invested $1,000 at the time of our recommendation,you’d have $963,866!* Now, it’s worth notingStock Advisor’s total average return is1,050% — a market-crushing outperformance compared to179%for the S&P 500. Don’t miss out on the latest top 10 list, available when you joinStock Advisor. See the 10 stocks » *Stock Advisor returns as of June 30, 2025 Anders Bylundhas positions in International Business Machines and Nvidia. The Motley Fool has positions in and recommends Advanced Micro Devices, International Business Machines, Microsoft, and Nvidia. The Motley Fool recommends the following options: long January 2026 $395 calls on Microsoft and short January 2026 $405 calls on Microsoft. The Motley Fool has adisclosure policy. This Dan Ives-Backed ETF Could Be the Smartest Way to Play the AI Revolutionwas originally published by The Motley Fool",2025-07-04
https://finance.yahoo.com/news/nvidia-stock-buy-red-hot-130002861.html,"Nvidia (NVDA) — the poster child of Wall Street’s artificial intelligence (AI) mania — is revered as the chip king powering the generative AI explosion, and its role has become bigger than ever. Last week, NVDA stock reminded everyone why. Nvidia blazed through a red-hot six-day win streak, rallying more than 10% and notching fresh all-time highs. It reclaimed its throne as the world's most valuable company, edging past Microsoft (MSFT). Investors shrugged off China jitters, bolstered by CEO Jensen Huang’s AI and robotics vision and optimism at the annual shareholder meeting. Michael Saylor Says ‘You’ll Wish You’d Bought More’ Bitcoin as MicroStrategy Doubles Down Is Microsoft Stock About to Go Nuclear? Wolfspeed Is Surging After Filing for Bankruptcy. Is It Too Late to Touch WOLF Stock Here? Markets move fast. Keep up by reading our FREE midday Barchart Brief newsletter for exclusive charts, analysis, and headlines. Loop Capital analyst Ananda Baruah helped reignite the rally, lifting the price target to a Street-high $250 and hailing Nvidia as the epicenter of a wave in AI spending. Meanwhile, Nvidia’s new Blackwell chips and AI-fueled demand paint a bold path to a $6 trillion valuation. Sure, insiders have offloaded more than $1 billion in stock over the past one year, but investor confidence hasn’t flinched. So, after a fiery six-day surge and bullish upgrades, is NVDA stock still worth buying? Nvidia hardly needs an introduction. It is the undisputed powerhouse behind the AI chip revolution. Boasting a market capitalization of $3.7 trillion, it earned its crown by building graphics processing units (GPUs), the brains of modern AI. Initially famed for fueling gaming and graphics, Nvidia rose to global prominence by pivoting early into AI, becoming the go-to supplier for Big Tech’s data-center ambitions. Now, CEO Jensen Huang has his sights on a new power play: sovereign AI. As countries push to build AI ecosystems free from Silicon Valley’s grip, Nvidia is arming them with the tools — Blackwell GPUs, AI factories, and more. From Europe to the Middle East, billion-dollar deals are stacking up. Nvidia kicked off 2025 with storm clouds overhead. China export curbs, rising tariffs, and geopolitical heat weighed heavily on investors’ sentiment. CEO Jensen Huang warned about potential fallout from losing access to a $50 billion market, and for a while, NVDA stock faltered. But momentum flipped fast. The AI chip king roared back, surging over 40% in just the past three months and climbing 14% over the past month. In fact, NVDA stock touched a fresh high of $158.71 on June 27. Loop Capital’s Street-high price target lit the fuse, but Huang’s talk of multi-trillion-dollar AI frontiers is what's keeping the bulls charged. Additionally, confidence is rising that China’s export limits won’t unseat Nvidia’s AI dominance, especially as global demand for compute power continues to break records. The Relative Strength Index (RSI) is now above 76, firmly in overbought territory. That signals red-hot momentum but simultaneously flashes a red flag that a breather may be near. NVDA stock currently trades at 39 times forward earnings and 29 times forward sales, a premium to the sector median and hardly cheap on the surface. But it’s a discount compared to its historical average. Digging deeper, with earnings projected to grow by double digits this year and next and margins holding strong, NVDA stock’s valuation looks more balanced than bloated. Its PEG ratio of 1.4 times even leans attractive. Free cash flow (FCF) rose 75% annually, and management is utilizing it, spending over $14 billion on buybacks in Q1 alone. The dividend remains tiny with a 0.03% yield, but capital returns are clearly gaining steam. When you combine explosive AI demand, disciplined capital allocation, and a runway for growth, the premium feels less speculative and more like a calculated bet on long-term dominance. On May 28, Nvidia reported its first-quarter fiscal 2026 earnings, and it was nothing short of impressive. Revenue surged to $44.1 billion, climbing 12% sequentially and 69% year-over-year (YOY), beating even the most bullish Street estimates. The firepower came from Nvidia's data center segment, which pulled $39.1 billion, a blistering 73% YOY surge. Data center revenue accounted for a dominant 88% of total revenue. Gaming wasn’t asleep either, clocking a record $3.8 billion, up 48% sequentially and 42% YOY. But it wasn’t all clean lines and green candles. U.S. export restrictions on H20 AI chips to China delivered a $4.5 billion body blow, tied to excess inventory and purchase commitments. That charge dragged GAAP gross margin down to 60.5%, with non-GAAP settling at 61%. Strip out the charge, and Nvidia’s non-GAAP gross margin hit a far healthier 71.3%. Non-GAAP EPS landed at $0.81, up 33% annually. That figure would have soared to $0.96 without the China hit. Even so, the market gave its nod, and NVDA stock rose 3.3% on May 29, signaling investor confidence despite the headwinds. Looking ahead, management expects approximately $45 billion in Q2 revenue. That’s with a potential $8 billion punch from H20 export curbs already factored in. With AI appetite surging worldwide, Nvidia’s vision remains sharply focused, even if the road now includes navigating geopolitical turbulence alongside record-breaking growth. Analysts monitoring Nvidia remain upbeat about the company’s growth. For Q2, they expect profits to climb 43% YOY to $0.93 per share. Looking further ahead, fiscal 2026 EPS is forecast to rise 36% annually to $4, followed by another surge of 32% to $5.29 in fiscal 2027. Loop Capital is betting big on Nvidia’s future. Analyst Ananda Baruah recently boosted his NVDA price target to $250 from $175, reaffirming a “Buy” rating. The analyst's bullish stance stems from what he calls a “Golden Wave” of generative AI, with Nvidia sitting firmly at the center. According to Loop, AI compute spending could skyrocket to $2 trillion by 2028, fueled by hyperscalers, sovereign AI initiatives, and the accelerating buildout of AI factories. Nvidia’s upcoming Blackwell chips, designed for high-intensity reasoning models, are expected to hit full production by the October quarter, another growth catalyst. Despite Nvidia’s massive rally, the analyst sees more runway ahead. In his view, Nvidia isn’t peaking — it's just getting warmed up. Meanwhile, Wedbush analyst Dan Ives is also bullish, calling Nvidia the backbone of the AI revolution. With sovereign AI investments ramping and chip demand hitting escape velocity, Ives sees Nvidia becoming the world’s first $4 trillion company this year. Ives reaffirmed his “Outperform” rating and a $175 price target on the AI chip stock. Overall, analysts are optimistic about NVDA, giving the stock a “Strong Buy” consensus rating. Of the 44 analysts covering the stock, 37 advise a “Strong Buy” while three suggest a “Moderate Buy,” three advise a “Hold,” and one suggests a “Strong Sell"" rating. The average analyst price target for NVDA stock is $176.62, indicating potential upside of more than 12%. Loop Capital’s Street-high target price of $250 suggests that shares could rally as much as 59% from here. Nvidia’s six-day rally and soaring valuation may look like a victory lap, but this is not without warning signs. Wall Street remains enamored as price targets rise and bulls view sovereign AI as the next trillion-dollar goldmine. But insiders are quietly cashing out, and competitors are rewriting the rules, shifting AI’s future from brute-force GPU scaling to leaner, smarter architectures. Meanwhile, China’s market has effectively closed to the U.S. industry. Sure, Nvidia still leads the charge. Its chips remain the backbone of AI infrastructure. But markets priced for perfection leave little room for detours. With valuation multiples high and forward growth tied to long-cycle plays, the path ahead demands more than just dominance. It demands reinvention. After this red-hot streak, the real question is not whether Nvidia is a giant. It’s whether Nvidia's next leap will outpace the growing weight of its own story. On the date of publication, Sristi Suman Jayaswal did not have (either directly or indirectly) positions in any of the securities mentioned in this article. All information and data in this article is solely for informational purposes. This article was originally published onBarchart.com",2025-07-04
