url,content,date
https://finance.yahoo.com/news/2-stocks-buy-summer-4-114502881.html,"Wall Street’s most expensive horse race is entering its final stretch. Nvidia (NVDA) trades at $3.74 trillion and Microsoft (MSFT) trades at $3.66 trillion. Wedbush’s Dan Ives believes the duo will sprint past $4 trillion in market value before summer ends. Driving these mammoth market caps, Ives argues that every dollar spent on Nvidia’s chips leads to $8 to $10 multiplication across the rest of the tech sector. Both companies are already posting blockbuster financials, and each has a near-monopolistic position in their respective AI niches. Thus, it’s worth taking a deeper look at Nvidia and Microsoft here. Is UnitedHealth Stock a Buy, Sell, or Hold for July 2025? Michael Saylor Says ‘You’ll Wish You’d Bought More’ Bitcoin as MicroStrategy Doubles Down Is Microsoft Stock About to Go Nuclear? Tired of missing midday reversals? The FREE Barchart Brief newsletter keeps you in the know. Sign up now! Dan Ives is highly bullish on NVDA stock and calls Nvidia the “foundation for the AI revolution,” adding that CEO Jensen Huang is the “Godfather of AI.” His rationale is that cloud service providers will increasingly acquire more AI-capable chips to build out their services. Nvidia is often the first, and sometimes the only, supplier these companies purchase from. It has been able to position itself as a premier supplier of both AI hardware and the required software for data centers. Ives believes the use cases of AI are “exploding” across many verticals. There is good substance to Ives’ claim that NVDA stock may indeed break through $4 trillion this summer. The stock broke through the $150 resistance level on June 25 and hit a new all-time high above $158 on June 27. It has been building on that momentum since. With $150 no longer a ceiling, its next resistance levels are in the low-$160 range, and some analysts have targets as high as $250 on shares. There have been no indications that Nvidia’s domestic customers are slowing down orders, and Blackwell remains fully booked for the year. The average analyst is also optimistic on NVDA, with a price target of $176.62. This implies 14% upside, or a market capitalization of roughly $4.3 trillion. Although Microsoft has temporarily lost its spot as the No. 1 most valuable company in the world, it may soon be able to close that gap as its AI momentum has been accelerating, and so has the stock. MSFT stock currently trades near $491. It is likely to meet some resistance near $500, but breaking through that level could unlock enough upside to get past Nvidia again. It is spending $80 billion on AI-related capital expenses in 2025 to add to its momentum. Dan Ives has set a price target of $600 on MSFT, up from $515 previously. OnCNBC, he was asked, “$600 doesn’t feel too lofty?... How much has to go right for that to happen?” Ives replied and said, “I think $600 is probably conservative, I’m thinking about the next 18 months.” He believes we are going into the software phase of AI and that CEO Satya Nadella is “playing chess” while the rest are playing checkers. Most analysts are still in the “conservative” camp, but price targets go up to $626. The highest price target here implies around 27% upside, and a market cap of $4.65 trillion. On the date of publication, Omor Ibne Ehsan did not have (either directly or indirectly) positions in any of the securities mentioned in this article. All information and data in this article is solely for informational purposes. This article was originally published onBarchart.com",2025-07-04
https://finance.yahoo.com/news/interview-fdi-center-nada-snoussi-113135039.html,"“Everyone is asking the question, is AI going to replace my job?” Nada Snoussi tellsInvestment Monitor. She says reading the news about mass layoffs at companies such as Microsoft, Meta, Dell, Klarna, and Google led her to ask how AI job disruption is affecting investment promotion agencies (IPAs). Snoussi wrote about this in a piece titled 'When AI cuts jobs, is it still worth attracting?' One of IPAs’ primary goals is to create job opportunities for the places they represent through foreign investment projects. Now, at a time when global FDI [foreign direct investment] is at a record low, but AI investments have never been higher, Snoussi thinks IPAs have to tread carefully. A consultant at the FDI Center, Snoussi said: “Many IPAs define quality FDI by its ability to create jobs. That's the case for most emerging countries, but also for developed countries. For these IPAs, this is a question that worries me more, because if we’re going to attract an AI company, are we going to attract them so that in the end, we achieve an opposite outcome to what we wanted to initially achieve? “It’s not a yes or no, but it’s definitely a whole discussion that needs to be brought in.” Snoussi thinks it is important to remember that while AI will replace some jobs, it is also creating new ones. It does not mean that the IPAs will necessarily have a harder task; they will just have to be more agile to the needs of an evolving workforce. “We have jobs that have been displaced when these are low-quality jobs, or jobs that are going to be easily automated. At the same time, it creates a new aspect of jobs that are linked to the core AI development such as jobs linked to machine learning, data centres, data analysis, engineering,” she outlines. She also suggests that as the world builds the AI supply chain and its critical infrastructure, jobs will be created along the way in areas such as data centres, education and energy. Aside from jobs directly in the core AI industry and supply chain, there is also the question of how AI will be applied to other sectors, which include agriculture and healthcare. Snoussi comments: “If we talk about agriculture, that’s anything linked to precision farming or crop management. Healthcare also, anything related to analysis of imagery, smart manufacturing.” IPAs should look at which sector-specific AI companies would complement their local economy. ""An AI company that we see clear potential to partner with other sectors in our country that would add value. Or focus on attracting AI companies that are sector-focused—so agritech, health tech, smart manufacturing, and so on—from the start, so that we directly add value to the sectors we have,” she says. Before IPAs make a concerted effort to attract AI, Snoussi says they should first ask: “Can we accommodate AI investors?” Two important factors for AI investors are an adequate energy supply and an AI-savvy workforce. Whether a location can provide both of these features will fundamentally shape an IPA's value proposition. IPAs could play an important role in advocating for the upskilling of their local workforce. Snoussi thinks that a partnership between different stakeholders that encourages “the creation of AI and upskilling programs with universities and research institutions”, for example, would strengthen an IPA's pitch to investors. If IPAs attract projects without taking these factors into consideration, they could inadvertently disrupt the local economy. “I wouldn’t, for instance, attract AI companies that would automate things if a place has a huge business process operations (BPO) sector,” Snoussi outlines. The Philippines, for example, offers a lot of BPO services, such as call centres. She said: “You’re not going to attract an AI company that offers automation of call centres that can do cold calls just using AI.” At the same time, she notes that these automated services are usually offered by small companies which might not “have the potential to expand”. So, just because an AI replacement exists, it does not mean it is going to grow or replace an industry overnight. “I think AI will replace some jobs that rely heavily on routine tasks, for instance, but it’s going to take time. Not all companies have the capabilities or the capacity today to directly automate all the processes, because AI automation is costly,” Snoussi outlines. This is good news for IPAs, because it means they “still have time” to work on upskilling their workforce and creating a strategy. In terms of integrating AI into an IPA’s operations, Snoussi thinks they should be wary of moving too quickly, as making a mistake could erode an organisation’s credibility. “I see many people saying that AI can be used by IPAs easily. No need for specialised tools. We can just use ChatGPT, for instance, to write emails to answer our questions. But then, to what level can we rely on these responses? There’s a big risk of AI hallucinations,” she comments. If an AI chatbot hallucinates, an occasion where it generates incorrect or factually inaccurate outputs, and an investor catches it, then it would damage that IPA's credibility, Snoussi notes. Therefore, if IPAs want to integrate this technology, they need “an AI tool that is trained by IPA professionals to minimise the risk of hallucination”. Given the speed of AI adoption in the workforce, there is no time to waste for IPAs. “AI is coming. It’s not a choice. We have to deal with it,” she advises. ""Interview: FDI Center’s Nada Snoussi on how IPAs should cope with AI job disruption"" was originally created and published byInvestment Monitor, a GlobalData owned brand.   The information on this site has been included in good faith for general informational purposes only. It is not intended to amount to advice on which you should rely, and we give no representation, warranty or guarantee, whether express or implied as to its accuracy or completeness. You must obtain professional or specialist advice before taking, or refraining from, any action on the basis of the content on our site.",2025-07-04
https://finance.yahoo.com/news/microsoft-announces-another-round-layoffs-110015442.html,"Microsoft has announced its second significant round of layoffs in recent months, affecting approximately 9,000 employees, or nearly 4% of its global workforce. The technology firm began issuing layoff notices on Wednesday 2 July 2025, impacting divisions such as its Xbox video game segment and other departments, reportedThe Associated Press. This wave of job cuts is the largest the company has implemented in more than two years. The layoffs will impact various teams worldwide, including the sales division, as part of organisational adjustments aimed at enhancing Microsoft's competitiveness in a rapidly changing market. In a memo to staff within the gaming division, Xbox CEO Phil Spencer mentioned that these changes are intended to steer the business towards long-term success by focusing on strategic growth. The layoffs also include 830 employees from Microsoft's headquarters in Redmond, Washington, as per a notification sent to state officials. The company did not disclose the total number of layoffs but confirmed it represents about 4% of the workforce reported a year ago, when Microsoft had 228,000 full-time employees as of June 2024. Microsoft had previouslylaid off around 6,000 workers in May 2025, marking its largest job reduction in more than two years before this current announcement. In addition, Microsoft's Spain-based King division, responsible for developing the Candy Crush video game, is reducing its workforce by 10%, equating to roughly 200 positions. These recent cutbacks coincide with Microsoft's continued substantial investments in data centres and AI infrastructure components like specialised computer chips. The company expects these expenses to amount to approximately $80bn in the current fiscal year which commenced earlier this week. Financially, Microsoft reported significant growth in its third-quarter results for fiscal year 2025. Revenue reached $70.1bn, marking a 13% increase from the previous year. Net income rose by 18% to $25.8bn, with operating income growing by 16% to $32bn. The tech giant attributed this positive performance to heightened demand for AI solutions and sustained adoption of cloud infrastructure by enterprises. ""Microsoft announces another round of layoffs, affecting 9,000 roles"" was originally created and published byVerdict, a GlobalData owned brand.   The information on this site has been included in good faith for general informational purposes only. It is not intended to amount to advice on which you should rely, and we give no representation, warranty or guarantee, whether express or implied as to its accuracy or completeness. You must obtain professional or specialist advice before taking, or refraining from, any action on the basis of the content on our site.",2025-07-04
https://finance.yahoo.com/news/ceos-ai-flex-091957569.html,"In today’s CEO Daily:Sharon Goldman on the trend of CEOs touting the amount of work being done by AI. The big story:Trump’s Big Beautiful Bill is one step closer to becoming law. The markets:Bouyant. Analyst notesfrom Goldman Sachs on employment, Pantheon Macroeconomics on job openings, and Wedbush on AI andTesla. Plus:All the news and watercooler chat fromFortune. Good morning. If you’re in the habit of listening to CEOs, you’ll noticea new trendamong leaders talking about AI. SalesforceCEO Marc Benioff said in arecent interviewthat AI now does up to 50% of all work at the company, in key functions like engineering, coding, and customer support. In May,MicrosoftCEO Satya Nadella said 20% to 30% of the tech giant’s code is now written by AI coding assistants. And in April,GoogleCEO Sundar Pichaisaidover 30% of code at Google is now generated by AI. It’s the latest CEO flex: Citing numbers showing that AI is doing heavy lifting internally. The move presents the company as being ahead of the AI curve and invariably grabs the attention of people who matter. Investors hear the magic words that the business is on track to save money—presumably accomplished—but rarely explicitly stated, through future job cuts. It also signals to clients of the Big Tech companies making the pronouncements that they should open their wallets, pronto, to incorporate more AI into their operations, or risk falling behind. But how significant these CEO flexes ultimately are from Salesforce, Google, and Microsoft is difficult to know. The metrics cited seem precise, yet when asked, their spokespeople declined to provide any details about how the numbers were calculated or how they defined the work that they claim AI has done. “The truth is, we don’t yet have a common framework for measuring what ‘percent of work’ really means in the age of AI,” said Malvika Jethmalani, founder of human capital advisory firm Atvis Group, in a message toFortune. “Are we counting lines of code, tasks completed, hours saved, or business outcomes influenced?” But Netherlands-based occupational psychologist Marais Bester thinks something else is afoot. “I think it’s also sort of an indicator to employees, saying, you better watch your back, you better perform.” From a business psychology standpoint, that’s not an indicator of good leadership, he added. Shonna Waters, an organizational psychologist and CEO of advisory firm Fractional Insights, thinks the companies that will succeed are those with “structural empathy”—that is, building systems that bring in frontline worker voices. “At the end of the day, you need the humans to still be the ones actually adopting the AI, you need to bring them along with your journey and figure out how to do it in concert with them, as opposed to something you’re doing to them.” You can read my full story forFortunehere. —Sharon Goldman More news below.Contact CEO Daily via Diane Brady atdiane.brady@fortune.com This story was originally featured onFortune.com",2025-07-04
https://finance.yahoo.com/news/magnificent-seven-makeover-stocks-earned-085500954.html,"With Apple and Tesla struggling, perhaps it's time for a shake-up in the ""Magnificent Seven"" lineup. Palantir's revenue growth is accelerating, and its long-term opportunities appear to be huge. Broadcom reports strong growth in its networking portfolio, and it has an even bigger opportunity in custom AI chips. 10 stocks we like better than Palantir Technologies › The so-called ""Magnificent Seven"" stocks --Alphabet,Apple(NASDAQ: AAPL),Amazon,Meta Platforms,Microsoft,Nvidia, andTesla(NASDAQ: TSLA)-- provided much of the driving force behind the market's strong growth over the past several years. However, these tech stocks are seeing some uneven performance in 2025, and it may be time for this informal group -- first labeled by aBank of Americaanalyst in 2023 -- to get a makeover. I think it's time to give Apple and Tesla the boot and replace them withPalantir Technologies(NASDAQ: PLTR)andBroadcom(NASDAQ: AVGO). Here's why it should be out with the old and in with the new when it comes to the Magnificent Seven. Both Apple and Tesla stocks have had poor starts to 2025. The reason for Apple's share price underperformance is that its revenue growth has slowed to a glacial pace, and investors' hopes for a strong smartphone upgrade cycle driven by itsartificial intelligence (AI)offerings have faded. In fact, Apple's revenue of $391 billion for its fiscal 2024 (which ended in September) was less than the $394.3 billion it generated in its fiscal 2022. Through the first half of fiscal 2025, its revenue is up 4% year over year, but that is still a slow pace. A big part of Apple's issues is that it has not innovated. It has had no new breakout products in the last several years, and the company is behind in AI. While Apple dedicated a lot of resources to AI, it has thus far very little to show for it. Apple Intelligence's introduction did little to convince most users to upgrade their iPhones, and it hasn't even launched Apple Intelligence in China yet. The Chinese market, meanwhile, remains a consistent weak spot for the company. Apple is losing smartphone market share to local rivals, and its revenue in the country has been on the decline. Xiaomi and Huawei have both launched smartphones to compete at the high-end of the market, and Apple has been forced to roll out sales incentives in China to try to spur demand. For a company that built its reputation not just as a technology company but as a luxury brand, that's a difficult path to go down. Apple has been generating solid growth in its high-margin services business, but it faces a unique risk: It is possible that regulators and the courts may force Alphabet to end the deal that makes Google the default search engine on Apple devices. Alphabet currently pays Apple an estimated $20 billion a year for that privileged positioning, which is pure profit for Apple. Any change to the deal could result in a big hit to its earnings. Tesla, meanwhile, has its own problems. Itselectronic vehicle (EV)deliveries and revenue fell last year, and it looks like things are getting worse. In the first quarter, its EV deliveries sank by 13% while auto revenue dropped by 20%. In the second quarter, EV deliveries fell an even worse 14%. Increased competition (especially in China) and the rising popularity of hybrid vehicles have played roles in Tesla's struggles, but some of the blame can also be pinned directly on the actions of CEO Elon Musk. Musk's support and financial backing of President Donald Trump and various Republicans in recent elections, and the subsequent leadership role he took on at Trump's ""Department of Government Efficiency"" (DOGE) have angered a lot of current and potential vehicle buyers. The constituencies Musk angered have political views that generally make them more likely to buy EVs than the demographic that supports President Trump. Musk's political actions led to protests and boycotts of Tesla in the U.S. and in several European countries where Tesla operates. More recently, Musk has become an outspoken critic of Trump's legislative efforts, irritating the president and his supporters. Musk even went so far as to threaten to start his own political party, potentially alienating all sides of the political spectrum. Not surprisingly, Tesla sales have been sinking in the U.S., Europe, and China. Tesla bulls are still betting that its robotaxi business will be a game changer. However, the recent pilot launch of the service in its first city has been met with skepticism and some well-documented potential safety issues. Meanwhile, Alphabet's Waymo has established the early lead in the driverless ride-sharing race. In my opinion, two of the best stocks to replace Apple and Tesla in the Magnificent Seven would be Palantir and Broadcom, both of which have had strong starts to the year. Palantir has become a growth machine. In Q1, it recorded its seventh straight quarter of accelerating revenue growth, with its top line climbing by 39% year over year. The greatest contributor to that growth was its largest customer -- the U.S. government. Revenue from federal government sources grew by 45% year over year (or about $116 million) to $373 million. Its sales to U.S. commercial customers grew at an even faster rate, but from a smaller base. They climbed by 71% (or about $106 million) to $255 million. Meanwhile, it recently landed a significant contract with NATO, showing that international defense has the potential to become a third meaningful growth pillar for the company. Much of Palantir's success stems from its Artificial Intelligence Platform (AIP), which it is positioning to be an AI operating system for its clients. AIP gathers data from various sources and puts it into an ""ontology"" that connects digital assets with their real-world counterparts, allowing organizations to use AI to help solve their real-world problems. The platform is already being used by clients across a wide swath of industries to manage an array of different issues, and the opportunities for it appear to be huge. Meanwhile, Palantir recently introduced new agentic AI tools that not only suggest actions but can also carry them out. Broadcom has also been seeing solid growth. Last quarter, its revenue climbed 20% year over year while adjusted earnings per share (EPS) soared 44%. The growth is being led by its AI networking portfolio, where it provides networking components such as Ethernet switches, optical receivers, DSPs, and NICs -- critical hardware for moving huge amounts of data across AI clusters. Last quarter, its AI networking revenue surged 70%. However, Broadcom's biggest opportunity lies in custom AI chips. The company helps customers design application-specific integrated circuits (ASICs) that can be used to power AI workloads. After its success in helping Alphabet design its tensor processing units (TPUs), Broadcom has been gaining more and more new custom AI chip customers. Three of its hyperscaler customers are well advanced in the ASIC design process, and Broadcom has stated that each one of them intends to deploy fabrics of 1 million AI chip clusters in 2027, representing a total serviceable opportunity for the company of $60 billion to $90 billion in that year alone. That's a huge opportunity, and it doesn't even include Broadcom's newer customers, such as Apple. Given the growth opportunities ahead for both Broadcom and Palantir, they look today like better candidates than Apple or Tesla to form a new and improved Magnificent Seven. Before you buy stock in Palantir Technologies, consider this: TheMotley Fool Stock Advisoranalyst team just identified what they believe are the10 best stocksfor investors to buy now… and Palantir Technologies wasn’t one of them. The 10 stocks that made the cut could produce monster returns in the coming years. Consider whenNetflixmade this list on December 17, 2004... if you invested $1,000 at the time of our recommendation,you’d have $697,627!*Or whenNvidiamade this list on April 15, 2005... if you invested $1,000 at the time of our recommendation,you’d have $939,655!* Now, it’s worth notingStock Advisor’s total average return is1,045% — a market-crushing outperformance compared to178%for the S&P 500. Don’t miss out on the latest top 10 list, available when you joinStock Advisor. See the 10 stocks » *Stock Advisor returns as of June 30, 2025 John Mackey, former CEO of Whole Foods Market, an Amazon subsidiary, is a member of The Motley Fool's board of directors. Bank of America is an advertising partner of Motley Fool Money. Suzanne Frey, an executive at Alphabet, is a member of The Motley Fool's board of directors. Randi Zuckerberg, a former director of market development and spokeswoman for Facebook and sister to Meta Platforms CEO Mark Zuckerberg, is a member of The Motley Fool's board of directors.Geoffrey Seilerhas positions in Alphabet. The Motley Fool has positions in and recommends Alphabet, Amazon, Apple, Bank of America, Meta Platforms, Microsoft, Nvidia, Palantir Technologies, and Tesla. The Motley Fool recommends Broadcom and recommends the following options: long January 2026 $395 calls on Microsoft and short January 2026 $405 calls on Microsoft. The Motley Fool has adisclosure policy. ""Magnificent Seven"" Makeover: Which Stocks Have Earned a Spot, and Which Haven't?was originally published by The Motley Fool",2025-07-04
