url,content,date
https://finance.yahoo.com/news/why-alphabet-stock-worth-less-125300519.html,"Alphabet would be the most valuable company in the world if it were valued similarly to its peers. It seems that earnings don't directly translate into higher share prices over the short term. However, at current levels, Alphabet's stock is too undervalued for investors to ignore. 10 stocks we like better than Alphabet › The stock market cares more about future earnings potential than the past -- and that may be whyNvidia,Microsoft,Apple(NASDAQ: AAPL), andAmazon(NASDAQ: AMZN)are all worth more thanAlphabet(NASDAQ: GOOG)(NASDAQ: GOOGL)today even though Alphabet is the onlyS&P 500stock with over $100 billion in trailing-12-month net income. Here's why the market views Alphabet's earnings differently than other megacapgrowth stocks, and whether Alphabet is a buy now. Earnings are one of the most important metrics investors use to value a company. How much profit a company generates is an integral part of an investment thesis. But so are expectations for future profits. Although net income is just a number, there are nuances worth understanding. A leading company that operates in a growing industry with competitive advantages, high profit margins, and a great balance sheet will have far higher-quality earnings than a company operating in a declining or even failing industry that is cyclical and capital-intensive. This concept is why even the best oil and gas companies, likeExxonMobilandChevron, sport such inexpensive valuations. Their earnings aren't high-margin. Generating them takes a lot of capital. And oil and gas consumption may look much different decades from now than today. This doesn't mean ExxonMobil and Chevron are bad companies. In fact, both areexcellent dividend stocks. It just means investors are unlikely to pay the same price for these companies relative to their earnings as, say, an ultra-fast-growing company with high margins like Nvidia. Alphabet doesn't have a capital-intensive business model. It generates high margins and has diverse revenue streams from its services like Google Search, Google Network, YouTube, Android, Google Cloud, and more. It also has a phenomenal balance sheet with more cash, cash equivalents, and marketable securities than debt. Despite these advantages, Alphabet sports a price-to-earnings (P/E) ratio and forward P/E ratio that are far lower than Nvidia, Microsoft, Apple, and Amazon. This discounted valuation is why Alphabet is worth less than its peers despite making more profit. Alphabet's valuation is much cheaper than some of its peers because investors are less optimistic about its future earnings prospects. Nvidia is powering the future of artificial intelligence (AI) with its graphics processing units for data centers. Big tech continues to spend on AI, so investors are optimistic that demand for Nvidia's products will continue growing. Microsoft is integrating AI into its software and is the No. 2 player in cloud computing behind Amazon. In contrast, Alphabet's Google Cloud is a distant third in market share. Apple isn't growing quickly, but the company has such a dominant, vertically integrated ecosystem of consumer products and services that investors are willing to pay a premium price for the stock relative to its earnings. Alphabet makes the majority of its operating income from Google Search. Unlike Amazon (and arguably Microsoft), cloud is not the most valuable aspect of the company. Alphabet's AI plays mainly come from Google Cloud and its ""Other Bets"" category, which consists of projects like self-driving company Waymo and AI research lab DeepMind, which is behind the chatbot Gemini. In sum, the market may be viewing Alphabet's business model as more vulnerable to technological advancements in AI than other megacap growth companies that are clearly benefiting from AI. There's a famous (and still relevant) quote by Warren Buffett that goes, ""You pay a very high price in the stock market for a cheery consensus."" Companies that are favorable to many investors tend to demand expensive valuations, whereas companies with an element of uncertainty can fetch a discount. The simplest reason to buy Alphabet right now is if you believe the market's skepticism about the company's AI potential is unwarranted or overblown. In that case, investors can buy Alphabet at a steep discount to its peers. If Alphabet had a 30 P/E ratio instead of a sub-20 P/E, it would be worth well over $3 trillion. If it had Microsoft's P/E, it would be the most valuable company in the world. In many ways, Alphabet deserves to trade at a discount to these other big tech names. But maybe only by a little bit -- not the drastic discrepancy we are seeing in the market today. All told, now is a great time for value investors interested in big tech to buy Alphabet stock. Before you buy stock in Alphabet, consider this: TheMotley Fool Stock Advisoranalyst team just identified what they believe are the10 best stocksfor investors to buy now… and Alphabet wasn’t one of them. The 10 stocks that made the cut could produce monster returns in the coming years. Consider whenNetflixmade this list on December 17, 2004... if you invested $1,000 at the time of our recommendation,you’d have $692,914!*Or whenNvidiamade this list on April 15, 2005... if you invested $1,000 at the time of our recommendation,you’d have $963,866!* Now, it’s worth notingStock Advisor’s total average return is1,050% — a market-crushing outperformance compared to179%for the S&P 500. Don’t miss out on the latest top 10 list, available when you joinStock Advisor. See the 10 stocks » *Stock Advisor returns as of June 30, 2025 Suzanne Frey, an executive at Alphabet, is a member of The Motley Fool's board of directors. John Mackey, former CEO of Whole Foods Market, an Amazon subsidiary, is a member of The Motley Fool's board of directors.Daniel Foelberhas positions in Nvidia. The Motley Fool has positions in and recommends Alphabet, Amazon, Apple, Chevron, Microsoft, and Nvidia. The Motley Fool recommends the following options: long January 2026 $395 calls on Microsoft and short January 2026 $405 calls on Microsoft. The Motley Fool has adisclosure policy. Why Is Alphabet Stock Worth Less Than Nvidia, Microsoft, Apple, and Amazon Even Though It Is the Most Profitable S&P 500 Company?was originally published by The Motley Fool",2025-07-04
https://finance.yahoo.com/news/3-stocks-boost-portfolio-nasdaq-125300821.html,"Nasdaq hit a fresh all-time closing high on Wednesday as investors grew hopeful about a rate cut in the coming weeks. Markets remained volatile over the past couple of months, which saw the tech-heavy index face several challenges. However, easing geopolitical tensions and tariff woes, along with optimism surrounding rate cuts, have helped the index make a solid rebound. The Nasdaq rally is primarily being driven by mega-cap tech stocks that stand to benefit from a rate cut and the ongoing enthusiasm surrounding artificial intelligence (AI). Given the ongoing tech rally and expectations of more rate cuts this year, it would be ideal to invest in Nasdaq stocks such asMicrosoft CorporationMSFT,Visa Inc.V andMastercard IncorporatedMA, whichhave strong potential for the near term. These stocks have a Zacks Rank #1 (Strong Buy) or 2 (Buy) and assure good returns. You can seethe complete list of today’s Zacks #1 Rank stocks here. On Wednesday, Nasdaq jumped 0.9% to hit a fresh closing high of 20,393.13 points. The tech-heavy index had earlier set a record high on Monday after climbing 0,5% to close at 20,369.73 points. Year to date, the Nasdaq Composite has gained 5.6% after surging 28.6% in 2024 to record its best year since 2020. Wednesday’s rally was led by tech stocks after the United States announced that it reached a trade deal with Vietnam. Several tech stocks have production units outside the United States, especially in Vietnam and China. Tech stocks had taken a beating after President Donald Trump announced sprawling tariffs on all trading partners of the United States in April. Tech stocks took an immediate hit as 145% tariffs were slapped on all Chinese imports. However, Nasdaq has made a remarkable comeback since April, following Trump's announcement of a temporary 90-day pause on tariffs and the initiation of negotiations with several countries. Last month, the White House said that it reached a trade deal with China, and now a trade agreement with Vietnam should lift investors’ sentiment. Although AI experts remain divided on the future of generative AI, the overall enthusiasm for this field has been remarkable over the past couple of years. Several experts believe that AI is still in its early development phase, with vast untapped potential.NVIDIA CorporationNVDA has emerged as a leader in the generative AI space, playing a key role in driving growing interest in the technology. So far this year, NVIDIA’s stock has jumped 17.10%. NVIDIA’s solid progress in generative AI has prompted other major tech companies to make their own mark in this evolving area. At the same time, the rise of smart devices is further boosting demand, as these gadgets rely on computing and machine learning capabilities for features such as facial recognition, image processing, and video analysis. These tasks require high-performance processors, fast speeds, ample memory, energy efficiency, and advanced graphics capabilities — all of which create strong demand within the semiconductor sector. As a result, the semiconductor industry has been witnessing a robust recovery over the past two years. Also, a shrinking job market and a steady decline in inflation over the past three months have raised hopes that the Federal Reserve will go for a rate cut as early as July. This is likely to further boost growth-oriented assets, particularly technology stocks. Generally, lower interest rates tend to favor such assets. Currently, investors are anticipating two rate cuts of 25 basis points each this year, which is expected to provide further support to tech stocks. Microsoft Corporationis one of the largest broad-based technology providers in the world. MSFT dominates the PC software market, with more than 73% of the market share for desktop operating systems. Microsoft Corporation’s Microsoft 365 application suite is one of the most popular productivity software globally. MSFT is also one of the prominent public cloud providers that can deliver a wide variety of infrastructure-as-a-service and platform-as-a-service solutions at scale. Microsoft Corporation has an expected earnings growth rate of 13.2% for the current year. The Zacks Consensus Estimate for current-year earnings has improved 0.4% over the last 60 days. MSFT presently carries a Zacks Rank #2. Visa Inc.operates as a payments technology company all over the world. The company went public in March 2008 via an initial public offering (IPO). V provides transaction processing services (primarily authorization, clearing and settlement) to financial institutions and merchant clients through VisaNet, its global processing platform. Visa has an expected earnings growth rate of 12.9% for the current year. The Zacks Consensus Estimate for current-year earnings has improved 0.4% over the last 60 days. V presently carries a Zacks Rank #2. Mastercard Incorporatedis a leading global payment solutions company that provides an array of services in support of credit, debit, mobile, web-based and contactless payments, and other related electronic payment programs to financial institutions and other entities. MA’s payment solutions include payment programs, marketing, product development, technology, processing, consulting and information services. Mastercard has an expected earnings growth rate of 9.5% for the current year. The Zacks Consensus Estimate for current-year earnings has improved 0.4% over the last 60 days. MA presently carries a Zacks Rank #2. Want the latest recommendations from Zacks Investment Research? Today, you can download 7 Best Stocks for the Next 30 Days.Click to get this free report Microsoft Corporation (MSFT) : Free Stock Analysis Report Mastercard Incorporated (MA) : Free Stock Analysis Report Visa Inc. (V) : Free Stock Analysis Report NVIDIA Corporation (NVDA) : Free Stock Analysis Report This article originally published on Zacks Investment Research (zacks.com). Zacks Investment Research",2025-07-04
https://finance.yahoo.com/news/microsoft-ai-chip-ambitions-hit-124455886.html,"July 3 -Microsoft (NASDAQ:MSFT) has quietly pushed its in?house AI chip plans out to 2028 and beyond, according to a Wednesday report fromThe Information. Instead of racing to hit its 2025 goal, the company will double down on interim designs that are quicker to finish. That means the Maia 200 chip now isn't expected until 2026, a year later than originally intended. Maia 100, by contrast, launched last year as planned. Warning! GuruFocus has detected 6 Warning Sign with MSFT. The bigger stars of the lineup, Braga, Braga?R and the next?gen Clea, have run into snags. Braga only cleared testing last month, putting it about six months off schedule. Braga?R won't hit mass production until 2028, and Clea has been bumped even further down the road. These shifts ripple out to Marvell Technology (NASDAQ:MRVL), which builds critical components for Microsoft's AI efforts. MRVL shares dipped about 1% on Wednesday as investors weighed the news. Amazon Web Services (NASDAQ:AMZN) also leans on Marvell for its Trainium chips. By reshuffling its roadmap, Microsoft is aiming to rely less on Nvidia (NASDAQ:NVDA) while still keeping its AI engine humming. The big question now: can this slower, steadier approach deliver the performance the market expects? Despite the delays, Microsoft's commitment to custom AI silicon feels as strong as ever, and everyone's watching to see if the gamble pays off. This article first appeared onGuruFocus.",2025-07-04
https://finance.yahoo.com/news/invested-1000-microsoft-decade-ago-123004861.html,"How much a stock's price changes over time is a significant driver for most investors. Not only can price performance impact your portfolio, but it can help you compare investment results across sectors and industries as well. FOMO, or the fear of missing out, also plays a role in investing, particularly with tech giants and popular consumer-facing stocks. What if you'd invested in Microsoft (MSFT) ten years ago? It may not have been easy to hold on to MSFT for all that time, but if you did, how much would your investment be worth today? With that in mind, let's take a look at Microsoft's main business drivers. Microsoft Corporation is one of the largest broad-based technology providers in the world. The company dominates the PC software market with more than 73% of the market share for desktop operating systems.The company’s Microsoft 365 application suite is one of the most popular productivity software globally. It is also one of the prominent public cloud providers that can deliver a wide variety of infrastructure-as-a-service (IaaS) and platform-as-a-service (PaaS) solutions at scale.Redmond, WA-based Microsoft’s products include operating systems, cross-device productivity applications, server applications, business solution applications, desktop and server management tools, software development tools and video games. Its software solutions and hardware devices are playing an important role in developing the metaverse.The company designs and sells PCs, tablets, gaming and entertainment consoles, other intelligent devices, and related accessories. Through Azure, it offers cloud-based solutions that provide customers with software, services, platforms and content.Microsoft reported revenues of $245.1 billion in fiscal 2024. The company reports operations under three segments: Productivity & Business Processes, Intelligent Cloud and More Personal Computing.Productivity & Business Processes accounted for 31.7% of fiscal 2024 revenues. The segment offers productivity and collaboration tools and services including Office 365, Dynamics business solutions, Teams, Relationship Sales solution, Power Platform and LinkedIn.Intelligent Cloud, which include Azure cloud services, contributed to 42.9% of fiscal 2024 revenues.Microsoft closed its acquisition of Activision Blizzard on October 13, 2023 for $75.4 billion. Activision Blizzard has been integrated as a sibling division to Xbox Game Studios and ZeniMax Media.More Personal Computing represented 25.3% of fiscal 2024 revenues. The segment comprises mainly the Windows, Gaming (Xbox hardware and Xbox software and services), Devices (Surface, PC accessories, and other intelligent devices) and Search (Bing and Microsoft Advertising) businesses. While anyone can invest, building a lucrative investment portfolio takes research, patience, and a little bit of risk. If you had invested in Microsoft ten years ago, you're probably feeling pretty good about your investment today. According to our calculations, a $1000 investment made in July 2015 would be worth $11,060.59, or a gain of 1,006.06%, as of July 3, 2025, and this return excludes dividends but includes price increases. Compare this to the S&P 500's rally of 199.86% and gold's return of 176.71% over the same time frame. Analysts are forecasting more upside for MSFT too. Microsoft capitalizes on AI business momentum and Copilot adoption alongside accelerating Azure cloud infrastructure expansion. Strong Office 365 Commercial demand has been propeling Productivity and Business Processes revenue growth notably. ARPU increases through E5 and M365 Copilot uptake across key segments. Intelligent Cloud revenues advance through Azure AI development and AI Copilot busines growth. Strategic execution has been enhancing non-AI services through enterprise customer growth and operational scale improvements. Xbox content and services benefit from robust performance across third-party and first-party content offerings. We expect that fiscal 2025 net sales will increase 13.7% compared to fiscal 2024. However, elevated operating expenses and Azure investments amid intensifying cloud competition remain concerns for the stakeholders. The stock is up 5.87% over the past four weeks, and no earnings estimate has gone lower in the past two months, compared to 3 higher, for fiscal 2025. The consensus estimate has moved up as well. Want the latest recommendations from Zacks Investment Research? Today, you can download 7 Best Stocks for the Next 30 Days.Click to get this free report Microsoft Corporation (MSFT) : Free Stock Analysis Report This article originally published on Zacks Investment Research (zacks.com). Zacks Investment Research",2025-07-04
https://finance.yahoo.com/news/datadog-joining-p-500-index-122511007.html,"Datadog (DDOG) stock is in focus this morning, thanks to the news that it’s set to join the benchmark S&P 500 Index ($SPX) effective July 9, replacing acquisition target Juniper Networks (JNPR). This marks a pivotal moment for the cloud observability leader, and the market's immediate response has been overwhelmingly positive, with DDOG stock surging approximately 8.7% in premarket trading. That puts DDOG on pace to break above its upper Bollinger Band, and would place the stock firmly in short-term overbought territory, based on its 14-day Relative Strength Index (RSI). Is UnitedHealth Stock a Buy, Sell, or Hold for July 2025? Michael Saylor Says ‘You’ll Wish You’d Bought More’ Bitcoin as MicroStrategy Doubles Down Is Microsoft Stock About to Go Nuclear? Our exclusive Barchart Brief newsletter is your FREE midday guide to what's moving stocks, sectors, and investor sentiment - delivered right when you need the info most. Subscribe today! Operating in a competitive cloud observability market valued between $2.9-8.56 billion, Datadog faces competition from established players like Elastic (ESTC), Amazon (AMZN), Microsoft (MSFT), and Cisco (CSCO). However, DDOG’s selection for S&P 500 inclusion over other candidates like AppLovin (APP) and Robinhood (HOOD) suggests a strategic preference for companies focused on foundational enterprise technology and infrastructure management. The stock’s new S&P 500 status is expected to drive considerable buying demand for Datadog shares, too, as index funds and ETFs will need to adjust their portfolios to maintain accurate benchmark representation. Datadog’s market capitalization of $46.63 billion significantly exceeds the S&P 500's minimum threshold of $22.7 billion, validating its position among America's leading corporations. The company's strong financial performance underpins this status, as evidenced by its impressive Q1 2025 results - where DDOG reported revenue of $761.55 million, representing a 25% year-over-year increase. Datadog's success in securing larger enterprise deals is particularly noteworthy, with 11 contracts worth at least $10 million signed in Q1 2025, demonstrating growing adoption across major enterprises. Additionally, the company's strategic investments and recent partnership with Microsoft-backed OpenAI have strengthened its position in the cloud monitoring and security space, particularly through innovations like its Bits AI offering. This month’s major S&P milestone not only validates Datadog's business model, but also signals the growing importance of software-defined infrastructure management in the modern economy. The timing is particularly significant, as it coincides with increasing enterprise adoption of cloud services and the company's strengthening position in agentic artificial intelligence (AI) trends, where autonomous systems operate without human intervention. Wedbush Securities has expressed increased confidence in Datadog's prospects by raising their price target to $170 from $140, citing the company's strong position in the observability space and elevated AI usage across its enterprise customer base. Analysts project significant margin improvement, with expectations for Datadog to reach 40% free cash flow margin by 2029, potentially driving substantial value creation. With AI and analytics budgets on the rise, Datadog's new go-to-market strategy is positioned to drive increased deal flow for cloud migration monitoring and digital transformation projects. Overall, Wall Street analysts rate DDOG stock a “Strong Buy,” although the shares are set to open today above their consensus price target of $140.57. Valued at a forward price/earnings-to-growth ratio of 3.02, investors should note that Datadog trades at a relatively steep premium - and with the stock looking overbought from a technical perspective, it could be somewhat risky to chase today’s rally in DDOG. This article was generated with the support of AI and reviewed by an editor. On the date of publication, the editor had a position in: MSFT. All information and data in this article is solely for informational purposes. This article was originally published onBarchart.com",2025-07-04
