url,content,date
https://finance.yahoo.com/news/nearly-23-2025-meta-platforms-181443184.html,"The fortunes of the “Magnificent 7” have diverged this year, and three constituents, namely Alphabet (GOOG), Apple (AAPL), and Tesla (TSLA), are in the red, with the Elon Musk-run company losing nearly a quarter of its market capitalization. Amazon (AMZN) shares are barely in the green while Microsoft (MSFT) and Nvidia (NVDA) are up in the mid-teens. With YTD gains of nearly 23%, Meta Platforms (META) is the best-performing constituent of the group, all of whose members are artificial intelligence (AI) plays in their own right. Earlier this year, I noted that Meta looks like the best AI play among the group. In this article, we’ll analyze whether the Mark Zuckerberg-led company still earns that title. Is UnitedHealth Stock a Buy, Sell, or Hold for July 2025? Is MicroStrategy Stock a Buy, Sell, or Hold for July 2025? Circle Just Applied for a Bank Charter. How Should You Play CRCL Stock Here? Markets move fast. Keep up by reading our FREE midday Barchart Brief newsletter for exclusive charts, analysis, and headlines. During the March quarter earnings call, while other major tech companies either maintained their AI capex guidance or else guided for spending to taper down in the future, Meta raised its 2025 capex guidance to between $64 billion and $72 billion compared to the previous guidance of $60 billion to $65 billion, citing higher investments in data centers. “We continue to increase our investments and focus more of our resources on AI,” said Zuckerberg during the earnings call. Meta has become even more ambitious and last month acquired a 49% stake in Scale AI, hiring its founder, Alexandr Wang, along with other key employees in the process. Notably, acquisitions have been a key growth pillar for Meta, and it previously acquired Instagram and WhatsApp, which helped it become the social media behemoth that it is today. Meta seems to be taking the same approach to AI, and where it cannot acquire a company, it has poached talent. Zuckerberg has been on an AI talent hiring spree and has hired former GitHub CEO Nat Friedman, who along with Wang, heads the company’s Superintelligence Labs. Additionally, Meta has hired several AI executives from Google, OpenAI, and Anthropic. In an internal memo, Zuckerberg said that while he is “excited” about the planned progress on the company’s Llama 4.1 and 4.2 models, he added, “In parallel, we’re going to start research on our next generation of models to get to the frontier in the next year or so.” Zuckerberg said that Meta is “uniquely positioned to deliver superintelligence to the world” and highlighted the progress in wearables and AI glasses. Hardware could be the next frontier for AI, and OpenAI paid a cool $6.5 billion to acquire Jony Ive’s startup, io Products. Ive was a former chief design officer at Apple, where he helped design the iPhone. Meta is making incremental progress in AI and is adding more AI features to its WhatsApp business suite. Large businesses will now be able to use AI-powered voice agents to reach their customers. Moreover, WhatsApp, which will now officially show ads to users, will also use AI for product recommendations on merchant sites. Notably, during its Q1 earnings call, Meta said that its AI digital assistant monthly user count is now almost 1 billion. According to Zuckerberg, AI will lead to better user engagement and “improved advertising.” He listed business messaging and Meta AI as the other growth drivers. While currently Meta does not charge for AI features, we can be reasonably assured that it will start doing so in the future. After the recent rally, Meta now trades very close to its mean target price of $722.96, even as it still has a consensus rating of “Strong Buy” from the 54 analysts actively covering the stock. The overall Meta story looks bullish to me, even as the forward price-earnings (P/E) ratio looks a bit elevated at 29x, which is not only higher than what the stock has historically traded at but also a premium to the broader market. However, Meta has seen a re-rating as markets give a thumbs up to its AI strategy. Moreover, the multiples will taper down as AI initiatives start adding to Meta's profit pool and its metaverse losses narrow in the coming quarters. I continue to believe that Meta is among the best, if not the best, AI plays out there. The next big story for the company could be AI glasses, and while these haven’t flown off the shelf yet, many believe that glasses could be the next prominent computing platform after smartphones. Overall, I will hold my shares even at these valuations as Meta reestablishes itself as a prominent AI stock. On the date of publication, Mohit Oberoi had a position in: META, AAPL, GOOG, MSFT, NVDA, AMZN, TSLA. All information and data in this article is solely for informational purposes. This article was originally published onBarchart.com",2025-07-03
https://finance.yahoo.com/news/microsoft-lays-off-9-000-170029460.html,"Microsoftannounced today it will cut approximately 9,000 jobs,representing just under 4% of its global workforce, in its largest round of layoffs since 2023. The reductions, which span multiple divisions, geographies, and levels of seniority, come as the company continues to reportrobust financial resultsbut seeks to streamline operations and adapt to rapid shifts in the technology landscape. Despite posting an18% year-over-year increase in net income last quarter—reaching $25.8 billion—Microsoft is moving ahead with significant headcount reductions. The company cited a need to reduce organizationallayers with fewer managers and streamline its products, procedures and roles. In its official statement, Microsoft said: “We continue to implement organizational changes necessary to best position the company and teams for success in a dynamic marketplace.” The layoffs are part of a broader restructuring effort that has now seen over 15,000 jobs eliminated this year, including6,000 positions in May. This latest round is expected to impact sales, customer-facing roles, and the Xbox gaming division. Xbox head Phil Spencer told staff the company would “end or decrease work in certain areas of the business and follow Microsoft’s lead in removing layers of management to increase agility and effectiveness.” Microsoft’s move reflects a wider trend among major technology companies, many of which are undergoing similar workforce reductions as they double down on artificial intelligence. The company has invested billions in AI infrastructure, andCEO Satya Nadella recently notedthat up to 30% of Microsoft’s code is now written by AI tools. While Microsoft has not directly attributed the layoffs to AI replacing human workers, the timing and focus of the cuts suggest a shift toward a leaner, more automated organization. The layoffs underline that the job market in tech is tightening even as companies like Microsoft continue to deliver strong earnings. Disclaimer: For this story, Fortune used generative AI to help with an initial draft. An editor verified the accuracy of the information before publishing. This story was originally featured onFortune.com",2025-07-03
https://finance.yahoo.com/news/microsoft-cutting-9-100-jobs-132000438.html,"Reports and rumorsof massive layoffs at Xbox have been building since late last month, and the first blood has now been spilled.Bloomberg reportsthat Candy Crush maker King is cutting 200 employees, or roughly 10 percent of its 2,000-person headcount, while multiple games across various Xbox studios, includingthe Perfect Dark reboot, have been canceled. TheSeattle Times reportsthat this is part of a larger 9,100-person cut to personnel across the tech giant. “We continue to implement organizational and workforce changes that are necessary to position the company and teams for success in a dynamic marketplace,” a Microsoft spokespersontold VGC, with Microsoft Gaming CEO Phil writing in a memo to staff that the layoffs “end or decrease work in certain areas of the business and follow Microsoft’s lead in removing layers of management to increase agility and effectiveness.” King is part of Activision Blizzard, which Microsoft officially acquired in late 2023 for $70 billion afteran extensive and brutal regulatory battleover concerns about market consolidation. Candy Crush, one of the most popular free-to-play mobile games in the world, had justreached 20 billion in lifetime revenueat the time, making it one of the most lucrative parts of the sale. It will also likely be the cornerstone of a long-threatened push to launch its own app store on smartphones following anti-trust losses by Apple and Google. Everwild, an action-adventure in production at Rare and revealed years ago for the Xbox Series X/Swas also canceled. The new IP from the Sea of Thieves maker was last seen at Microsoft’s 2020 gaming showcase, with reported reboots and leadership changes following years later after nearly a decade in development. A new MMORPG codenamed Blackbird from Elder Scrolls Online maker ZeniMax Studios was also canceled today after a lengthy production timeline,Bloomberg reported. Kotaku understands that cuts are underway at State of Decay 3 studio Undead Labs as well. The current wave of mass layoffs hitting Xbox follows multiple other rounds that Microsoft has implemented in the wake of its gaming acquisition spree. Nearly 2,000 staff across the gaming division were cut in January 2024, followed by the closures of critically acclaimed studios like Tango Gameworks and Arkane Austin in May. Around 600 more layoffs followed in September, with Microsoft saying at the time that no games were canceled as a result of that round of cuts. That’s unlikely to be the case this time around, with the full extent of the culling rumored to potentially include entire studios. Microsoft’s expansive portfolio of game development teams includes ones like Obsidian Entertainment which have prodigiously shipped almost half a dozen games since being bought, as well as others like Undead Labs which have spent years working on sequels that have yet to materialize. Xbox has also been retreating from its console hardware business amidst reported pressure to improve its bottom line, leading to major first-party exclusives like Sea of Thieves and Gears of War going multiplatform on PlayStation 5. “We’re accountable to Microsoft for running a good business, a healthy business that continues to grow at both top line and bottom line,” Spencersaid at Summer Game Fest in June, hinting at the current upheaval. “That’s kind of a foundation for us. And what that does is it allows us to continue to invest in Xbox for our community of players and creators and that we’re doing it. It does mean we have to make trade-offs through the year on things that we’re going to invest more in, things that we’re not going to invest as much in because...we are the business that we are.” Update 7/2/2025 12:28 p.m. ET: Added further info about cuts and cancelations. Update 7/2/2025 1:18 p.m. ET: Added info about Perfect Dark. . For the latest news,Facebook,TwitterandInstagram.",2025-07-03
https://finance.yahoo.com/news/microsoft-plans-lay-off-thousands-160231544.html,"Microsoft said Wednesday it plans to lay off nearly 4% of its workforce, impacting an estimated 9,000 workers. The news comes just weeks after a reported 3% cut to its workforce affecting roughly 6,000 people. Microsoft and its big tech peers are facing pressure to trim headcounts as they ramp up spending on artificial intelligence.  Microsoft (MSFT) plans to make more cuts to its global workforce, affecting thousands of workers. The tech titan plans to slash its headcount by nearly 4%, Microsoft confirmed toInvestopediaWednesday. The cuts could impact an estimated 9,000 workers, andprimarily affectsales teams, according to reporting fromBloomberg. “We continue to implement organizational changes necessary to best position the company and teams for success in a dynamic marketplace,” a Microsoft spokesperson toldInvestopedia. The latest cuts come just weeks after a reported3% workforce reductionaffecting roughly 6,000 employees. CFO Amy Hood told analysts during the company's earnings call in April that Microsoft was ""building high-performing teams and increasing our agility by reducing layers with fewer managers."" The company employed some 228,000 employees worldwide as of the end of fiscal 2024, with around 120,000 in the U.S., according to a regulatory filing. Microsoft, along with many other big tech companies, faces pressure to lower its headcount as it ramps up investments in AI. D.A. Davidson analyst Gil LuriatoldInvestopedialast month that for every year Microsoft continues to invest at current levels, the company could be pushed to eliminate roughly 10,000 positions or allow them to go unfilled. Several of Microsoft's big tech peers, including Google parent Alphabet (GOOGL) and Amazon (AMZN), have also made recent cuts. In June,Google extended buyout offersto U.S. employees across the company, expanding the scope of buyout offers earlier in the year. Shares of Microsoft were little changed in recent trading. They have gained about 17% in 2025 so far. Read the original article onInvestopedia",2025-07-03
https://finance.yahoo.com/news/zillow-ceo-ditched-microsoft-money-155901000.html,"ZillowCEO Jeremy Wacksman left his cushyMicrosoftjob in 2009 for the “money-losing real estate startup.”In the thick of the U.S. housing crisis, his friends told him he’d never make money. But they were wrong: Over 15 years later and rising through the ranks to Zillow’s CEO, the company boasts a $17 billion market cap, and he says his success is partly thanks to the lateSteve Jobs. The2008 financial crisisburned bad memories intothe back of Americans’ brains: employees being laid off in droves, families struggling to put food on their tables, and a housing market in peril. ButZillow’s current CEO, Jeremy Wacksman, says the time was the start of a new beginning. Less than one year later, he ditched his job as a marketing and product manager atMicrosoftXbox to join the real estate startup, despite nervous looks from his friends. “Back in early 2009, for those that remember, [it] was not a fantastic real estate market,” Wacksman toldFortunerecently in aLeadership Next podcastepisode. “I remember talking to friends and family [that] I was going to leave a job at Microsoft…And they were like, ‘Why are you going to go work for this money-losing real estate startup? Real estate’s a terrible market.’” The Gen Xer explained that his marketing degree is what got him the job at Microsoft—but also, what inspired him to ultimately leave. “Building a product and then getting that product ever-present in the user’s mind, that’s been the common theme I’ve seen, and it’s driven my passion,” Wacksman said. “It’s what led me to Zillow and it’s honestly what keeps me at Zillow.” Wacksman joined Zillow as the VP of marketing and product, right around the time the late Steve Jobs introduced theAppleapp store—and it turned out to be exactly what the struggling company needed. Zillow declined to share additional comment toFortune. One of the most pivotal moments for the $17 billion real-estate marketplace came shortly after Wacksman joined the business as the VP of marketing and product: Apple was finally taking websites mobile with apps for the iPhone. “Six months after I got here, Steve Jobs launched the App Store on the iPhone, and it became clear that this company that had 100-plus people and was a great desktop website needed to go into mobile,” Wacksman recalled toFortune’sKristin StollerandDiane Brady. “Mobile was going to be the future.” Now, many online businesses, from Zillow andAirbnb, toeBayandEtsy, all have their own bespoke apps to bring convenience to customers. Thanks to Apple’s invention, users could rent out an apartment easily on their phone, sitting in their back pocket. And because Wacksman had spent a quarter of his time at Microsoft working on mobile projects, he was tapped to lead the effort—and saying yes to taking on work outside of his day-to-day responsibilities proved to be a career-defining moment. “I wasn’t hired to [help the company go mobile], I was hired to work on the product and marketing efforts. But mobile was new, and I said yes,” Wacksman said. “And in many ways, my career was just 15 years of saying yes to the next thing.” Wacksman slowly rose the ranks over the next decade and a half, assuming roles including chief marketing officer, president, and chief operating officer, before taking the helmas CEOin August 2024. Reflecting on his time at Zillow and the many other ‘yes’ moments he’s committed to, Wacksman said he’s learned to embrace opportunity. There will be times that projects fall through or unexpected challenges come into the fold, but the experiences make for a better leader. “You’ll throw yourself into something and it’ll work, or you’ll throw yourself into something and it won’t work,” Wacksman said. “You’ll have to pivot, but you’ll have learned something.” This story was originally featured onFortune.com",2025-07-03
https://finance.yahoo.com/news/microsoft-says-laying-off-4-142806728.html,"Microsoft is laying off just under 4% of its workforce in a new round of job cuts, the company said Wednesday. The cuts will affect 9,000 workers across the company, as it continues to make moves to trim its staff. ""We continue to implement organizational changes necessary to best position the company and teams for success in a dynamic marketplace,"" a Microsoft spokesperson said in a statement to CBS News. The latest round of layoffs comes afterthe company slashed more than 6,000 jobsin May and June, in an effort to streamline operations. The previous job cuts were intended to flatten the organization ""by reducing layers with fewer managers,"" Microsoft Chief Financial Officer Amy Hood said on an April earnings call. As of June 2024, the Redmond, Washington-based company employed roughly 228,000 people worldwide, according to companydata. Wednesday's move jibes with the organization's overarching goal to cut the number of managers per team. It also comes as Microsoft encourages employees to lean on new technologies and capabilities to focus on meaningful work, a company spokesperson said. Microsoft reported net income of nearly $26 billion, and revenue of more than $70 billion, for the third quarter ending in March. It is one of the most profitable companies, with a market capitalization of $3.7 trillion, according to FactSet. Watch: Bryan Kohberger pleads guilty for 2022 murders of 4 University of Idaho students Explosion at fireworks facility in California, local evacuations ordered Victim's father speaks out about Kohberger guilty plea, ""He's not gonna take accountability""",2025-07-03
https://finance.yahoo.com/news/microsoft-cut-9-000-jobs-154524616.html,"Microsoft is cutting 9,000 jobs as executives order staff todelegate more work to artificial intelligence (AI). The $3.6 trillion (£2.7 trillion) technology giant will shed 4pc of its workforce, it confirmed on Wednesday, with redundancies hitting divisions including its Xbox arm and King, its mobile games studio. The job losses follow a round of cutbacksin May, when Microsoft laid off 6,000 staff including hundreds of middle-managers and engineering roles. The technology business had more than 228,000 employees at the end of its last fiscal year. “We continue to implement organisational changes necessary to best position the company and teams for success in a dynamic marketplace,” a Microsoft spokesman said. The cuts come after Satya Nadella, Microsoft’s chief executive, claimed that up to 30pc of the company’s code was now being written by AI bots. Executives have been pushing staff to adopt more AI tools to speed up their work. Julia Liuson, the president of Microsoft’s developer division, recently told managers to consider whether an employee was using AI enough as part of their performance reviews, according to Business Insider. “Using AI is no longer optional,” she said in an email. “It’s core to every role and every level. AI should be part of your holistic reflections on an individual’s performance and impact.” The job cuts come amid growing fears that entry-level and engineering roles risk being replaced by AI bots. Tools such as ChatGPT can write emails or reports in plain English, generate code or create graphics and pictures. While tech executives have promised AI will help create more jobs than it destroys, there are already signs that some roles are disappearing from the jobs market. Software vacancies have fallen sharply since ChatGPT was released in November 2022. Executives are increasingly demanding programmers augment their roles with AI bots that can generate code themselves. The Telegraph reported this week thatentry-level jobs in the UK were down by a thirdsince the launch of ChatGPT. A report from Github, which is owned by Microsoft, found 50pc of developers had embraced “AI-assisted” coding. Mark Zuckerberg, the Facebook founder, said he expected AI to be able to do the work of a “mid-level engineer” this year. Tech giants are investing hundreds of billions of dollars in AI products and infrastructure at the same time as cutting jobs. In January, Microsoft said it expected to spend $80bn on AI technology this year.",2025-07-03
https://finance.yahoo.com/news/kleinknecht-electric-companies-goes-live-175600662.html,"In the news release, Kleinknecht Electric Companies Goes Live on SIS Advanced CRM for Construction Solution, issued30-Jun-2025by SIS, LLC over PR Newswire, we are advised by the company that the product name ""SIS Construct 365"" should read ""SIS Construct 365 Project Management"" throughout the release. The complete, corrected release follows: ATLANTA,June 30, 2025/PRNewswire/ -- SIS, LLC, a leading provider of construction technology solutions, is pleased to announce that Kleinknecht Electric Companies (KEC), a premier electrical contracting firm, has officially gone live with the SIS Construct 365 Project Management solution, powered by Microsoft Dynamics 365 CRM. This milestone marks a major step in modernizing KEC's operations by streamlining its sales, estimating, project management, and document management processes. Kleinknecht Electric Companies, known for its excellence in commercial and industrial electrical services, selected SIS Construct 365 Project Management  to unify and optimize key construction business functions—particularly in sales, estimating, and project management. Built on the Microsoft Dynamics 365 platform, SIS Construct 365 Project Management  delivers a construction-focused CRM that supports the full project lifecycle—from opportunity through closeout. The solution enables a streamlined approach to sales, handoff, and project execution, eliminating data silos and enhancing workflow efficiency and transparency. ""We chose SIS Construct 365 Project Management for its seamless integration with Microsoft Dynamics CRM and its ability to meet the unique demands of an electrical contracting business,"" saidNathan Weise- CFO / CTO of the Kleinknecht Electric Companies. ""The solution is already transforming the way we plan and manage projects—equipping us with the tools to stay competitive, drive exceptional financial results and further scale the enterprise."" ""Working with the team at Kleinknecht was a case study in how new software implementations should be completed,"" saidSteven Mulka, Partner at SIS. ""The team demonstrated strong leadership and active participation, which guided how our solution was configured and rolled out to improve their business operations."" This successful deployment reinforces SIS's reputation for delivering tailored, Microsoft-based solutions that drive operational excellence in the construction industry. SIS remains committed to helping contractors like KEC achieve sustainable growth through digital transformation. About Kleinknecht Electric Companies Kleinknecht Electric Companies is a premier provider of electrical contracting services for commercial and industrial projects. Known for its commitment to quality, innovation, and safety, KEC serves clients across the region with high-performance electrical solutions. About SIS SIS is a Microsoft-certified construction technology partner specializing in Dynamics 365-based solutions that streamline project management, financials, CRM, and operations. SIS supports construction and project-driven firms acrossNorth Americawith proven implementation expertise and industry-specific innovation. For more information about SIS Construct 365, visit sisn.com or contactinfo@sisn.com View original content to download multimedia:https://www.prnewswire.com/news-releases/kleinknecht-electric-companies-goes-live-on-sis-advanced-crm-for-construction-solution-302494753.html SOURCE SIS, LLC",2025-07-03
