url,content,date
https://finance.yahoo.com/news/artificial-intelligence-ai-stocks-quietly-114100958.html,"Micron is gaining market share with its latest high-bandwidth memory chips -- designed for AI products. IBM’s consulting services are driving its success in the generative AI market. These two companies are excelling in AI without dominating headlines. 10 stocks we like better than International Business Machines › Someartificial intelligence (AI) stocksinspire tons of headlines. You probably know exactly whatNvidia(NASDAQ: NVDA)andMicrosoft(NASDAQ: MSFT)are doing in the AI space, whether their stocks are doing well or not. And then there's the quiet bunch. I can assure you thatIBM(NYSE: IBM)andMicron Technology(NASDAQ: MU)do plenty of AI-related business, and that they stand to benefit from this ongoing boom in generative AI. Their stocks have been outperforming theS&P 500(SNPINDEX: ^GSPC)in 2025, apart from a couple of short-lived glitches. But how often do you see them mentioned among the top AI stocks to own for the long haul? Not a whole lot, I bet. So let me tell you what these tech veterans are doing to earn consistently market-beating performance this year -- without dominating the press. Micron is not the largest memory-chip maker in the world, but it has an advantage over sector leadersSK HynixandSamsung(OTC: SSNL.F)right now. The Idaho-based chip maker is first to market with the fourth generation of high bandwidth memory (HBM) -- a key component in the latest and greatest AI accelerator platforms. Samsung and Hynix have their own HBM4 solutions, but Micron is already shipping these chips to its most important customers. AI hardware leaderNvidia(NASDAQ: NVDA)includes Micron's HBM4 memory on its Blackwell family of AI accelerators. Runner-upAMD(NASDAQ: AMD)also selected Micron's top-of-the-line memory for its next two generations of Instinct accelerators. As a result, Micron's market share is growing while Samsung is sliding back. Now, Micron's sales are limited by the company's in-house production capacity, as the HBM chips are sold out for the rest of 2025. That's why Micron has invested $10.2 billion in capital expenses over the last three quarters, up from $5.3 billion in the same year-ago period. These costly chip-factory upgrades will be the foundation of Micron's long-term growth opportunity. So Micron is a leading supplier of AI-grade memory solutions. The stock has gained a market-beating 47% in the first half of 2025. Now you know why. Do you still see IBM as a one-stop shop for corporate computing needs? That would be a mistake. The company refocused on AI,cloud computing, and consulting services long before it was cool. The strategy shift led to many years of disappointing shareholder returns, but the big payoff is finally coming in. And of course, Big Blue's fortunes are built around AI. In the recent first-quarter update, IBM posted an order book of more than $6 billion in the WatsonX generative AI service. That's up from roughly $1 billion in the year-ago quarter. That's a big jump. And here's the fun part -- only 20% of this incoming contract portfolio comes from software licenses. The rest springs from consulting services. This is a unique business advantage. IBM's technical expertise goes far beyond its own software tools. When your company's employees need training on a new technology, or hands-on expertise from IT consultants, you're likely to look at IBM's consulting services. Yes, other tech giants can support their in-house software and services, but they're less likely to offer broad technology support. This isn't a new trend. Before the Fool, two different employers sent me to IBM's training centers around the country to keep me up to date with networking standards and programming tools. That was 20 years ago and nothing has changed -- except IBM's heavier focus on high-value topics such as AI systems and cloud computing. IBM's stock has gained 33% in 2025, and the underlying business results were largely based on consulting services in the AI market. If you knew that five minutes ago, you were already ahead of the game. If not, you just earned an edge on most AI investors. Before you buy stock in International Business Machines, consider this: TheMotley Fool Stock Advisoranalyst team just identified what they believe are the10 best stocksfor investors to buy now… and International Business Machines wasn’t one of them. The 10 stocks that made the cut could produce monster returns in the coming years. Consider whenNetflixmade this list on December 17, 2004... if you invested $1,000 at the time of our recommendation,you’d have $722,181!*Or whenNvidiamade this list on April 15, 2005... if you invested $1,000 at the time of our recommendation,you’d have $968,402!* Now, it’s worth notingStock Advisor’s total average return is1,069% — a market-crushing outperformance compared to177%for the S&P 500. Don’t miss out on the latest top 10 list, available when you joinStock Advisor. See the 10 stocks » *Stock Advisor returns as of June 30, 2025 Anders Bylundhas positions in International Business Machines, Micron Technology, and Nvidia. The Motley Fool has positions in and recommends Advanced Micro Devices, International Business Machines, Microsoft, and Nvidia. The Motley Fool recommends the following options: long January 2026 $395 calls on Microsoft and short January 2026 $405 calls on Microsoft. The Motley Fool has adisclosure policy. These Artificial Intelligence (AI) Stocks Have Quietly Outperformed the Market All Yearwas originally published by The Motley Fool",2025-07-03
https://finance.yahoo.com/news/microsoft-msft-recovered-losses-q1-113919271.html,"Qualivian Investment Partners, an investment partnership focused on long-only public equities, released its Q1 2025 investor letter. A copy of the letter can bedownloaded here. The fund outperformed the iShares MSCI USA Quality Factor ETF (QUAL) by 66.0% and 59.4% on a gross and net basis, since inception through March 31, 2025. It also exceeded the S&P 500 by 32.7% and 26.1% respectively, on a gross and net basis. In Q1 2025, the fund outperformed QUAL by 5.3% and 5.2% on a gross and net basis, and we outperformed the S&P 500 by 5.2% and 5.1% on a gross and net basis. In addition, please check the fund’s top five holdings to know its best picks in 2025. In its first-quarter 2025 investor letter, Qualivian Investment Partners highlighted stocks such as Microsoft Corporation (NASDAQ:MSFT). Microsoft Corporation (NASDAQ:MSFT) is a multinational software company that develops and supports software, services, devices, and solutions. The one-month return of Microsoft Corporation (NASDAQ:MSFT) was 6.07%, and its shares gained 6.79% of their value over the last 52 weeks. On July 1, 2025, Microsoft Corporation (NASDAQ:MSFT) stock closed at $492.05 per share, with a market capitalization of $3.657 trillion. Qualivian Investment Partners stated the following regarding Microsoft Corporation (NASDAQ:MSFT) in its Q1 2025 investor letter: A development team working together to create the next version of Windows. Microsoft Corporation (NASDAQ:MSFT) is in second position our list of30 Most Popular Stocks Among Hedge Funds. As per our database, 284 hedge fund portfolios held Microsoft Corporation (NASDAQ:MSFT) at the end of the first quarter compared to 317 in the previous quarter. In the fiscal third quarter of 2025, Microsoft Corporation (NASDAQ:MSFT)reported$70.1 billion in revenues, up 13% year-over-year. While we acknowledge the potential of Microsoft Corporation (NASDAQ:MSFT) as an investment, our conviction lies in the belief that AI stocks hold greater promise for delivering higher returns, and doing so within a shorter timeframe. If you are looking for an AI stock that is as promising as NVIDIA but that trades at less than 5 times its earnings, check out our report about theundervalued AI stock set for massive gains. Inanother article, we covered Microsoft Corporation (NASDAQ:MSFT) and shared large-cap stocks to buy from Goldman Sachs stock portfolio. In addition, please check out ourhedge fund investor letters Q1 2025page for more investor letters from hedge funds and other leading investors. While we acknowledge the potential of MSFT as an investment, we believe certain AI stocks offer greater upside potential and carry less downside risk. If you’re looking for an extremely undervalued AI stock that also stands to benefit significantly from Trump-era tariffs and the onshoring trend, see our free report on thebest short-term AI stock. READ NEXT:The Best and Worst Dow Stocks for the Next 12 Monthsand10 Unstoppable Stocks That Could Double Your Money. Disclosure: None. This article is originally published atInsider Monkey.",2025-07-03
https://finance.yahoo.com/news/nvidia-reclaimed-market-value-pole-112351177.html,"(Reuters) -Nvidia (NVDA) reclaimed the top spot among the most valued companies worldwide in June, as its shares were supported by renewed optimism over its leadership inartificial intelligenceand expectations of surging demand for its AI chips. The chipmaker's market value stood at $3.86 trillion at the end of June, about 4.3% higher thanMicrosoft Corp's $3.69 trillion valuation. However, Nvidia's market value has yet to surpassApple Inc's (AAPL) record high of about $3.92 trillion set in December 2024. Apple, with a market capitalization of $3.1 trillion, ranked as the third most valuable company at the end of last month. Meta Platforms Inc (META), Broadcom Inc (AVGO), and Amazon.com Inc (AMZN) saw their market values rise by 14%, 13.9%, and 7% respectively last month, reaching $1.86 trillion, $1.3 trillion, and $2.33 trillion. The market value ofTesla Inc(TSLA) dropped 8.3% to $1.02 trillion last month, with sentiment hit by CEOElon Musk's feud with U.S. PresidentDonald Trump. ""We believe both Nvidia and Microsoft (MSFT) will hit the $4 trillion market cap club this summer and then over the next 18 months the focus will be on the $5 trillion club ... as this tech bull market is still early being led by the AI Revolution,"" said Daniel Ives, an analyst at Wedbush Securities. (Reporting by Gaurav Dogra in Bengaluru;Editing by Vidya Ranganathan and David Evans)",2025-07-03
https://finance.yahoo.com/news/premier-league-microsoft-partner-enhance-095543263.html,"The English Premier League in the UK has entered a five-year partnership with Microsoft to leverage AI in enhancing the fan experience. As agreed, Microsoft will serve as the official cloud and AI partner for the league’s digital infrastructure and operations. The collaboration introduces a new AI assistant called Premier League Companion. Powered by Microsoft Copilot, the tool utilises Azure OpenAI to provide insights about clubs, players, and matches. According to Microsoft, Premier League Companion can pull information from over 30 seasons of stats, 300,000 articles and 9,000 videos. The AI assistant will be available on both the official Premier League mobile app and web platforms, with plans for further enhancements throughout the season. Upcoming features will include open-text questions and answers in multiple languages through text and audio translation. Microsoft AI will also be integrated into the Fantasy Premier League experience, providing users with a personal assistant manager for their fantasy teams. In addition, the integration of Microsoft Azure AI Foundry services will enhance live match experiences with real-time data overlays and post-match analysis. The Premier League will also migrate its core technology infrastructure to Microsoft Azure, aiming for enhanced scalability, security, and agility. This migration will facilitate faster innovation and seamless AI service integration. Internally, Microsoft 365, Power Platform, and Dynamics 365 Finance and Operations will streamline operations and improve collaboration within the league. Microsoft executive vice-president and chief commercial officer Judson Althoff said: “We are pleased to partner with the Premier League to bring innovative and interactive experiences to football fans around the world. “By leveraging our secure cloud and AI technologies, including Azure AI Foundry Services with Azure OpenAI, Microsoft 365 Copilot, and Dynamics 365, we will transform how football is experienced, delivered and managed on and off the field.” AI technology is increasingly adopted by sports leagues to manage data and enhance fan engagement. Spain's LaLiga, featuring clubs such as Real Madrid and FC Barcelona, also employs AI for match analysis and fan interaction. ""Premier League and Microsoft partner to enhance fan experience with AI"" was originally created and published byVerdict, a GlobalData owned brand.   The information on this site has been included in good faith for general informational purposes only. It is not intended to amount to advice on which you should rely, and we give no representation, warranty or guarantee, whether express or implied as to its accuracy or completeness. You must obtain professional or specialist advice before taking, or refraining from, any action on the basis of the content on our site.",2025-07-03
https://finance.yahoo.com/news/gdpr-services-market-report-2025-081100966.html,"The rise in data breaches and stringent global data protection regulations are propelling demand. Key players like IBM and Microsoft lead, with Europe as the top market. GDPR Services Market Dublin, July 02, 2025 (GLOBE NEWSWIRE) -- The""GDPR Services Market Report by Offering, Deployment Type, Organization Size, End User, and Region 2025-2033""has been added toResearchAndMarkets.com'soffering.The global GDPR services market size, having reached USD 3 Billion in 2024, is poised for significant growth, projected to hit USD 16.8 Billion by 2033. This translates to a robust CAGR of 20.05% during 2025-2033. The market expansion is primarily fueled by the increasing frequency of data breaches, heightened consumer awareness about data privacy rights, and stringent international data protection regulations. GDPR Services Market Analysis: Market Growth and Size:With a rise in data breaches and stringent data regulations, the demand for GDPR services is surging as businesses aim to protect consumer data and maintain trust. Technological Advancements:Innovations in AI-driven compliance tools and automated data protection solutions are streamlining GDPR services, attracting widespread business adoption. Industry Applications:Key sectors adopting GDPR services include healthcare, finance, and e-commerce, driven by compliance needs and consumer trust-building efforts. Geographical Trends:Europe retains market leadership due to GDPR's foundational role in data protection laws globally, while North America shows fast-growing interest, spurred by rising compliance demands. Competitive Landscape:Major players in the market are expanding service offerings, including data encryption, consent management, and audits, to meet diverse compliance needs. Challenges and Opportunities:Although regulatory complexities pose challenges, comprehensive GDPR solutions offer growth opportunities, especially for firms expanding into new markets. Future Outlook:The future is promising, with tighter regulations and elevated data privacy requirements driving the market, favoring companies offering comprehensive compliance solutions. GDPR Services Market Trends Increasing data breaches and cybersecurity concerns:The spike in cybersecurity incidents highlights the necessity of robust data protection, prompting businesses to invest in GDPR services. This investment, focusing on data encryption and access controls, is crucial for maintaining data security and public confidence. Consumer privacy awareness and expectations:As consumer understanding of data privacy deepens, businesses are compelled to ensure compliance and transparency, using GDPR services to safeguard their reputations and align with consumer expectations. Stringent data protection regulations:Global regulations like GDPR are forcing businesses into compliance, driving demand for GDPR consulting and technology solutions. Globalization of businesses and cross-border data flows:With businesses expanding internationally, complying with different data laws is essential. GDPR services help navigate this complex regulatory environment. GDPR Services Market Segmentation Breakup by Offering: Data Management Data Discovery and Mapping Data Governance API Management Data management holds the largest market share, essential for GDPR compliance. Breakup by Deployment Type: On-premises Cloud-based Cloud-based solutions dominate, favored for their scalability and flexibility. Breakup by Organization Size: Large Enterprises Small and Medium-sized Enterprises Large enterprises lead due to complex compliance needs and resource availability. Breakup by End User: BFSI Retail Healthcare Education Manufacturing Government and Public Sector Others The BFSI sector leads, reflecting the critical need for data security in finance. Breakup by Region:Europe is at the forefront due to GDPR's influence, while North America and the Asia-Pacific are experiencing rising demand. Regions like Latin America and the Middle East/Africa are emerging with growing GDPR compliance needs. Leading Key Players in the GDPR Services Industry: Absolute Software Corporation Amazon Web Services Inc. Capgemini SE International Business Machines Corporation Informatica Iron Mountain Inc. Micro Focus International PLC Microsoft Corporation Oracle Corporation Proofpoint Inc. SAP SE Trustwave Holdings Inc. Veritas Technologies LLC Key Attributes Report Attribute Details No. of Pages 147 Forecast Period 2024-2033 Estimated Market Value (USD) in 2024 $3 Billion Forecasted Market Value (USD) by 2033 $16.8 Billion Compound Annual Growth Rate 21.1% Regions Covered Global For more information about this report visithttps://www.researchandmarkets.com/r/kvkftm About ResearchAndMarkets.comResearchAndMarkets.com is the world's leading source for international market research reports and market data. We provide you with the latest data on international and regional markets, key industries, the top companies, new products and the latest trends. Attachment GDPR Services Market CONTACT: CONTACT: ResearchAndMarkets.com Laura Wood,Senior Press Manager press@researchandmarkets.com For E.S.T Office Hours Call 1-917-300-0470 For U.S./ CAN Toll Free Call 1-800-526-8630 For GMT Office Hours Call +353-1-416-8900 ",2025-07-03
