url,content,date
https://finance.yahoo.com/news/gaming-become-next-revenue-pillar-183400667.html,"NetflixNFLX offers games to keep its audience engaged. The streaming giant serves more than 300 million paid households, offering ample engagement opportunities through its “no-cost” gaming titles.Netflix focuses on offering immersive narrative games based on its content, with the most recent example being the launch ofSquid Game: Unleashed, which came alongside the release ofSquid Game Season 3. Even non-members can play the game — a strategic move to attract new users to Netflix’s platform.The company is focusing on mainstream titles likeGrand Theft Autoand expanding into kids' games with the launch of thePeppa Piggame. Moreover, socially engaging party games represent a category that Netflix plans to penetrate over the long term.Netflix plans to invest in game development, but in a measured way. Over the long term, the company expects games to generate roughly $140 billion in consumer spending, excluding ad revenues.Increasing engagement trends driven by a more diverse entertainment offering and a strong games portfolio bodes well for Netflix’s prospects. For the second quarter of 2025, NFLX forecasts revenues to increase 15.4% (+17% F/X neutral) to $11.035 billion. Netflix continues to forecast 2025 revenues of $43.5-$44.5 billion, which assumes healthy member growth, higher subscription pricing and a rough doubling of ad revenues. Netflix faces stiff competition from players likeTake-Two InteractiveTTWO andElectronic ArtsEA.Take Two Interactive benefits from a solid portfolio that includesNBA 2K25/2K24,Grand Theft Auto Online,Toon Blast,Empires & Puzzles,Red Dead Redemption 2andWords With Friends. Take-Two Interactive's future release slate holds significant growth potential. The announced lineup includes major titles spanning multiple genres. The titles includeMafia: The Old Country,Borderlands 4,NBA 2K26,WWE 2K26,CSR 3,Civilization VIIfor Switch, and the immensely anticipatedGrand Theft Auto VI, scheduled for May 2026.Electronic Arts expects continued growth in live services, as well as the launch of new non-annual titles in fiscal 2027. Its popularity is primarily driven by its well-known franchises, which will continue to fuel the top line. EA SPORTS titles, along withMadden NFL,The SimsandApex Legends, are some of its biggest franchises. Electronic Arts is positioned for strong growth with two major franchise launches in fiscal year 2026 —BattlefieldandSkate. NFLX shares have appreciated 45.7% year to date, outperforming both - Zacks Consumer Discretionary sector’s return of 11.8%, as well as the Zacks Broadcast Radio and Television industry’s 37.7%. Image Source: Zacks Investment Research  From a valuation standpoint, Netflix trades at a premium with a forward 12-month P/S ratio of 12.11X compared with the broader sector’s  2.32X. NFLX has a Value Score of D.  Image Source: Zacks Investment Research  The Zacks Consensus Estimate for NFLX’s 2025 earnings is pegged at $25.32 per share, unchanged over the past 60 days. This indicates a 27.69% increase over 2024’s reported figure. Netflix, Inc. price-consensus-chart | Netflix, Inc. Quote Netflix currently carries a Zacks Rank #3 (Hold). You can see the complete list of today’s Zacks #1 Rank (Strong Buy) stocks here. Want the latest recommendations from Zacks Investment Research? Today, you can download 7 Best Stocks for the Next 30 Days.Click to get this free report Netflix, Inc. (NFLX) : Free Stock Analysis Report Take-Two Interactive Software, Inc. (TTWO) : Free Stock Analysis Report Electronic Arts Inc. (EA) : Free Stock Analysis Report This article originally published on Zacks Investment Research (zacks.com). Zacks Investment Research",2025-07-02
https://finance.yahoo.com/news/netflix-lofty-valuation-even-bullish-095619842.html,"(Bloomberg) -- Netflix Inc. investors face a dilemma: Continue to bet on a stock that has delivered best-in-class returns over the past year or reconsider shares that increasingly look like they’re priced for perfection. Most Read from Bloomberg Struggling Downtowns Are Looking to Lure New Crowds Philadelphia Transit System Votes to Cut Service by 45%, Hike Fares Sprawl Is Still Not the Answer California Exempts Building Projects From Environmental Law The streaming giant’s stock price has nearly doubled over the last 12 months amid growth from advertising sales, subscription price increases and limited exposure to tariffs. While that makes it one of the best performing S&P 500 members over that span, it’s also boosted its valuation to 45 times expected earnings for the next year. In comparison, Nvidia Corp. is priced at 32 times while the Nasdaq 100 is at 27 times. Such a premium valuation, Netflix’s highest since 2021 — when its growth was being supercharged by the pandemic — is making even bullish investors wary of a potential sell off. Second-quarter earnings are due on July 17. “I feel really good about its fundamentals, in terms of its pricing power, ad business and move into live events, but expectations have gotten to the point that any disappointment would be a risk,” said Michael Smith, senior portfolio manager and head of growth equity at Allspring Global Investments. After tumbling in 2022 amid slumping subscriber growth, Netflix shares have roared back as the company cracked down on password sharing and turned to advertising to boost revenue. Meanwhile, live events like WWE Raw are helping attract new subscribers. Netflix is the fourth best-performing stock in the Nasdaq 100 this year and now boasts a market value of $570 billion, bigger than Mastercard Inc. and Exxon Mobil Corp. Netflix’s revenue is expected to rise 14% in 2025, down from 16% growth in 2024, according to the average of analyst estimates compiled by Bloomberg. While that’s a vast improvement from 2022, when revenue rose by about 6.5%, it pales in comparison to 2020 and 2021, when Netflix’s sales jumped 24% and 19%, respectively, as pandemic era lockdowns sent subscriber growth soaring. Still, most analysts on Wall Street remain bullish on the stock with a slate of programming this year that includes NFL games, boxing and new seasons of the popular shows Squid Game and Stranger Things. Last month, Oppenheimer & Co. described Netflix’s outlook as “ironclad” and raised the price target on the stock, one of many to do so in June. However, the shares have risen faster than analysts have upped their projections, leaving Netflix trading roughly 10% above the average price target of $1,217, suggesting limited upside potential over the coming months. Plenty of investors are undeterred by Netflix’s valuation. Ken Mahoney, chief executive officer of Mahoney Asset Management, acknowledges it’s a steep price to pay but believes Netflix’s market dominance justifies the premium. “People often miss great companies because they worry about valuation, and I don’t have a problem spending up for what Netflix offers,” Mahoney said. Netflix is “doing all the right things and is like a snowball getting bigger as it rolls downhill.” Another factor that’s helped power Netflix’s rally is that the stock has become much more widely owned. According to Bank of America data published at the end of May, Netflix was owned by 49% of long-only funds, making it the ninth-most-widely-held technology stock. About 14% of such funds held the stock in early 2016. Despite all of the tailwinds in Netflix’s favor, Allspring Global’s Smith questions what will be the next driver of Netflix’s rally given the high valuation. “There is a lot of fundamental momentum at Netflix, but the valuation backdrop has changed, and it is hard to say that this kind of multiple expansion is repeatable,” Smith said. Tech Chart of the Day Chinese automakers continued to expand their European foothold in May, capturing the highest share ever of hybrid-car sales and the biggest slice of the electric-vehicle market in 10 months. Manufacturers led by BYD Co. and SAIC Motor Corp.’s MG surpassed 9% share in both of those categories, based on figures from industry researcher Dataforce. Including combustion-engine models, European registrations of Chinese-branded cars topped 5% for the first time. Top Tech News Apple Inc. is considering using artificial intelligence technology from Anthropic PBC or OpenAI to power a new version of Siri, sidelining its own in-house models in a potentially blockbuster move aimed at turning around its flailing AI effort. Meta Platforms Inc. Chief Executive Officer Mark Zuckerberg announced a major restructuring of the company’s artificial intelligence group, including a commitment to developing AI “superintelligence,” or systems that can complete tasks as well as or even better than humans. The prospective buyer of TikTok’s American operations cited by President Donald Trump is the same investor consortium including Oracle Corp., Blackstone Inc. and venture capital firm Andreessen Horowitz, whose bid for the app had stalled amid US-China trade tensions, according to a person familiar with the matter. Nintendo Co. pulled its products from Amazon.com Inc.’s US site after a disagreement over unauthorized sales, meaning the e-commerce company missed out on the recent debut of Nintendo’s Switch 2 — the biggest game console launch of all time. Microsoft Corp.’s top sales executive is planning to take a two-month sabbatical, a move that coincides with an expected wave of terminations targeting his organization. Wolfspeed Inc., a chipmaker caught in President Donald Trump’s push to reshape Biden-era tech subsidies, filed bankruptcy to enact a creditor-backed plan to slash $4.6 billion in debt. Earnings Due Tuesday No major earnings expected --With assistance from Rob Golum and Anthony Palazzo. (Updates chart and valuation data in second paragraph.) Most Read from Bloomberg Businessweek America’s Top Consumer-Sentiment Economist Is Worried SNAP Cuts in Big Tax Bill Will Hit a Lot of Trump Voters Too How to Steal a House China’s Homegrown Jewelry Superstar Pistachios Are Everywhere Right Now, Not Just in Dubai Chocolate ©2025 Bloomberg L.P.",2025-07-02
https://finance.yahoo.com/news/why-netflix-nflx-outpaced-stock-214506706.html,"In the latest trading session, Netflix (NFLX) closed at $1,339.13, marking a +1.21% move from the previous day. This move outpaced the S&P 500's daily gain of 0.52%. On the other hand, the Dow registered a gain of 0.63%, and the technology-centric Nasdaq increased by 0.48%. Heading into today, shares of the internet video service had gained 9.6% over the past month, outpacing the Consumer Discretionary sector's gain of 5.55% and the S&P 500's gain of 4.27%. Investors will be eagerly watching for the performance of Netflix in its upcoming earnings disclosure. The company's earnings report is set to be unveiled on July 17, 2025. The company is predicted to post an EPS of $7.05, indicating a 44.47% growth compared to the equivalent quarter last year. Our most recent consensus estimate is calling for quarterly revenue of $11.05 billion, up 15.59% from the year-ago period. For the entire fiscal year, the Zacks Consensus Estimates are projecting earnings of $25.32 per share and a revenue of $44.47 billion, representing changes of +27.69% and +14.01%, respectively, from the prior year. Additionally, investors should keep an eye on any recent revisions to analyst forecasts for Netflix. These recent revisions tend to reflect the evolving nature of short-term business trends. Consequently, upward revisions in estimates express analysts' positivity towards the business operations and its ability to generate profits. Based on our research, we believe these estimate revisions are directly related to near-term stock moves. To capitalize on this, we've crafted the Zacks Rank, a unique model that incorporates these estimate changes and offers a practical rating system. The Zacks Rank system, which ranges from #1 (Strong Buy) to #5 (Strong Sell), has an impressive outside-audited track record of outperformance, with #1 stocks generating an average annual return of +25% since 1988. Over the past month, there's been a 0% fall in the Zacks Consensus EPS estimate. Netflix is holding a Zacks Rank of #3 (Hold) right now. Valuation is also important, so investors should note that Netflix has a Forward P/E ratio of 52.25 right now. This expresses a premium compared to the average Forward P/E of 14.71 of its industry. One should further note that NFLX currently holds a PEG ratio of 2.56. The PEG ratio is akin to the commonly utilized P/E ratio, but this measure also incorporates the company's anticipated earnings growth rate. As of the close of trade yesterday, the Broadcast Radio and Television industry held an average PEG ratio of 1.2. The Broadcast Radio and Television industry is part of the Consumer Discretionary sector. With its current Zacks Industry Rank of 96, this industry ranks in the top 40% of all industries, numbering over 250. The Zacks Industry Rank gauges the strength of our industry groups by measuring the average Zacks Rank of the individual stocks within the groups. Our research shows that the top 50% rated industries outperform the bottom half by a factor of 2 to 1. You can find more information on all of these metrics, and much more, on Zacks.com. Want the latest recommendations from Zacks Investment Research? Today, you can download 7 Best Stocks for the Next 30 Days.Click to get this free report Netflix, Inc. (NFLX) : Free Stock Analysis Report This article originally published on Zacks Investment Research (zacks.com). Zacks Investment Research",2025-07-02
https://finance.yahoo.com/news/netflix-inc-nflx-45-analysts-211325517.html,"Netflix, Inc. (NASDAQ:NFLX) is among the13 Best Big Name Stocks to Buy Now. Last week, two Wall Street analysts lifted their price targets for the stock, suggesting that it could continue to see growth ahead. The company’s shares are already up by over 45% year-to-date. A home theater with family members enjoying streaming content together. On June 20, Pivotal Research raised its price target for Netflix, Inc. (NASDAQ:NFLX) to $1,600 from $1,350, while reiterating a Buy rating for the stock. The analysts cited confidence in the company’s market dominance and robust valuation metrics as the reasons behind the adjustment. Jeffrey Wlodarczak said the following in a client note: The firm noted that Netflix, Inc. (NASDAQ:NFLX)’s scale remains a critical competitive advantage. They also expect the company to benefit as rivals offload premium library content. On the same day, analysts at Wells Fargo also lifted Netflix, Inc. (NASDAQ:NFLX)’s price target to $1,500 from $1,222, representing a 16% upside potential from its current trading value. The overall sentiment around the stock remains bullish, with Wall Street analysts having a consensus Buy rating for the stock. While we acknowledge the potential of NFLX as an investment, we believe certain AI stocks offer greater upside potential and carry less downside risk. If you're looking for an extremely undervalued AI stock that also stands to benefit significantly from Trump-era tariffs and the onshoring trend, see our free report on thebest short-term AI stock. READ NEXT:Goldman Sachs Stock Portfolio: 10 Large-Cap Stocks To BuyandBuffett Stock Portfolio: Top 10 Stock Picks for 2025. Disclosure: None.",2025-07-02
https://finance.yahoo.com/news/zacks-analyst-blog-highlights-berkshire-144300855.html,"Chicago, IL – June 30, 2025 – Zacks.com announces the list of stocks featured in the Analyst Blog. Every day the Zacks Equity Research analysts discuss the latest news and events impacting stocks and the financial markets. Stocks recently featured in the blog include: Berkshire Hathaway Inc. (BRK.B), Netflix, Inc. NFLX, Toyota Motor Corp. TM, Crimson Wine Group, Ltd. CWGL and Cemtrex CETX. The Zacks Research Daily presents the best research output of our analyst team. Today's Research Daily features new research reports on 16 major stocks, including Berkshire Hathaway Inc., Netflix, Inc. and Toyota Motor Corp., as well as two micro-cap stocks Crimson Wine Group, Ltd. and Cemtrex. The Zacks microcap research is unique as our research content on these small and under-the-radar companies is the only research of its type in the country.These research reports have been hand-picked from the roughly 70 reports published by our analyst team today.You cansee all of today's research reports here >>>Ahead of Wall StreetThe daily 'Ahead of Wall Street' article is a must-read for all investors who would like to be ready for that day's trading action. The article comes out before the market opens and attempts to make sense of that morning's economic releases and how they will affect that day's market action. You can read this article for free on our home page and can actually sign up there to get an email notification as this article comes out each morning.You can read today's AWS here >>>PCE Mostly In-Line, Pre-Markets Rally AgainToday's Featured Research ReportsBerkshire Hathaway'sshares have outperformed the Zacks Insurance - Property and Casualty industry over the past year (+19.4% vs. +19.2%). The company is one of the largest property and casualty insurance companies with numerous diverse business activities. A strong cash position supports earnings-accretive bolt-on buyouts and is indicative of its financial flexibility.Continued insurance business growth fuels an increase in float, drives earnings and generates maximum return on equity. The non-insurance businesses have also been doing well in the last few years. The insurer has also started increasing its investment in Japan. A sturdy capital level provides further impetus.However, exposure to cat loss induces earnings volatility and also affects underwriting results. Huge capital expenditure remains a headwind. Also, it remains to be seen how the behemoth fares when Greg Abel succeeds Warren Buffett as CEO of Berkshire.(You canread the full research report on Berkshire Hathaway here >>>)Shares ofNetflixhave outperformed the Zacks Broadcast Radio and Television industry over the year-to-date period (+46.8% vs. +34.7%). The company is benefiting from its growing subscriber base, thanks to a robust localized and foreign-language content portfolio and healthy engagement levels with about two hours of viewing per member per day, indicating strong member retention.NFLX's advertising tier now accounts for more than 55% of new sign-ups in available markets. NFLX has set an ambitious target to double its revenues by 2030 and reach a $1 trillion market capitalization, supported by a diversified content strategy, including international programming, live events, and gaming initiatives.The 2025 content slate with returning hit shows likeSquid Game,WednesdayandStranger Thingshold promise. However, stiff competition in the streaming space from Apple, Amazon Prime Video and Disney+ is a headwind.(You canread the full research report on Netflix here >>>)Toyota Motor'sshares have declined -14.2% over the past year against the Zacks Automotive - Foreign industry's decline of -17.0%. The company's operating profits in the current fiscal year are expected to take a big hit due to material prices and tariffs, along with investment in human resources and growth areas. High R&D expenses and capital expenditures are likely to limit the company's near-term margins and cash flows. The stock warrants a cautious stance now.Nevertheless, the surge in hybrid adoption is boosting Toyota's sales. The RAV4 model, with hybrid variants that make up about half of Toyota's sales, is America's top-selling SUV. Upbeat outlook for fiscal 2026 sales sparks optimism.Toyota Motor aims to lower hydrogen costs by promoting its use in commercial vehicles. It plans to sell its hydrogen-powered units externally, encouraging broader adoption. Its investor-friendly moves also spark optimism.(You canread the full research report on Toyota Motor here >>>)Shares ofCrimson Winehave underperformed the Zacks Beverages - Alcohol industry over the past year (-9.4% vs. -5.7%). This microcap company with market capitalization of $111.37 million is facing downside risks which includes margin pressure from inventory write-downs, declining Wholesale volume, export disruptions from Canada trade tensions, and unresolved cybersecurity litigation. Elevated inventories and softening demand could weigh on near-term profitability.However, Crimson Wine Group offers a resilient investment case anchored by its premium, estate-driven wine portfolio across key U.S. AVAs and strong vertical integration. Its diversified revenue streams — spanning Wholesale, Direct-to-Consumer (DTC), and export channels — provide stability amid demand shifts.Margin expansion is supported by a favorable sales mix and sustainable vineyard practices. The DTC segment remains structurally profitable, with growing e-commerce offsetting wine club attrition. Climate-resilient operations and prudent capital management enhance long-term continuity.(You canread the full research report on Crimson Wine here >>>)Cemtrex'sshares have underperformed the Zacks Electronics - Miscellaneous Components industry over the year-to-date period (-62.9% vs. -11.1%). This microcap company with market capitalization of $1.9 million is witnessing liquidity constraints and reliance on episodic, project-based revenues impair visibility and limit strategic flexibility. Shareholder dilution and mixed margin dynamics remain key risks, despite recent profitability improvements.Nevertheless, Cemtrex, through Vicon, is expanding in the $83 billion AI-driven surveillance and infrastructure markets with its NEXT camera platform, gaining traction in education and prison security. In second-quarter fiscal 2025, Security revenues surged 110% year over year with 52% gross margins and $4.3 million operating income, while AIS grew 13.2% on infrastructure demand and solid margin contribution.Cemtrex's AI-driven portfolio (NEXT, Anavio) supports a shift to higher-margin, recurring revenues. Cemtrex's current valuation reflects a steep market discount, suggesting a potential upside if execution stabilizes.(You canread the full research report on Cemtrex here >>>) Why Haven't You Looked at Zacks' Top Stocks? Since 2000, our top stock-picking strategies have blown away the S&P's +7.7% average gain per year. Amazingly, they soared with average gains of+48.4%, +50.2%and+56.7%per year. Today you can access their live picks without cost or obligation. See Stocks Free >> Media Contact Zacks Investment Research 800-767-3771 ext. 9339 support@zacks.com https://www.zacks.com Past performance is no guarantee of future results. Inherent in any investment is the potential for loss.This material is being provided for informational purposes only and nothing herein constitutes investment, legal, accounting or tax advice, or a recommendation to buy, sell or hold a security. No recommendation or advice is being given as to whether any investment is suitable for a particular investor. It should not be assumed that any investments in securities, companies, sectors or markets identified and described were or will be profitable. All information is current as of the date of herein and is subject to change without notice. Any views or opinions expressed may not reflect those of the firm as a whole. Zacks Investment Research does not engage in investment banking, market making or asset management activities of any securities. These returns are from hypothetical portfolios consisting of stocks with Zacks Rank = 1 that were rebalanced monthly with zero transaction costs. These are not the returns of actual portfolios of stocks. The S&P 500 is an unmanaged index. Visit https://www.zacks.com/performance for information about the performance numbers displayed in this press release. Want the latest recommendations from Zacks Investment Research? Today, you can download 7 Best Stocks for the Next 30 Days.Click to get this free report Toyota Motor Corporation (TM) : Free Stock Analysis Report Netflix, Inc. (NFLX) : Free Stock Analysis Report Berkshire Hathaway Inc. (BRK.B) : Free Stock Analysis Report Crimson Wine Group Ltd. (CWGL): Free Stock Analysis Report Cemtrex Inc. (CETX) : Free Stock Analysis Report This article originally published on Zacks Investment Research (zacks.com). Zacks Investment Research",2025-07-01
